,Artist,Song Title,Full Title,Release Date,Year,Month,Day,Pageviews,url,featured_count,producer_count,writer_count,Song Lyrics,Artist Image,gender,genre
0,Black Sabbath,Paranoid,Paranoid by Black Sabbath,1970-09-18,1970,9,18.0,636449,https://genius.com/Black-sabbath-paranoid-lyrics,0,1,4,  finished with my woman cause she couldnt help me with my mind people think im insane because i am frowning all the time  all day long i think of things but nothing seems to satisfy think ill lose my mind if i dont find something to pacify  can you help me occupy my brain oh yeah  i need someone to show me the things in life that i cant find i cant see the things that make true happiness i must be blind  you might also like make a joke and i will sigh and you will laugh and i will cry happiness i cannot feel and love to me is so unreal  and so as you hear these words telling you now of my state i tell you to enjoy life i wish i could but its too late,https://images.genius.com/46514480a048fb777f012318a43be54f.1000x1000x1.jpg,male,rock
1,Black Sabbath,Iron Man,Iron Man by Black Sabbath,1970-09-18,1970,9,18.0,540323,https://genius.com/Black-sabbath-iron-man-lyrics,0,1,4, i am iron man  has he lost his mind can he see or is he blind can he walk at all or if he moves will he fall  is he alive or dead has he thoughts within his head well just pass him there why should we even care   he was turned to steel in the great magnetic field when he travelled time for the future of mankind  nobody wants him he just stares at the world planning his vengeance that he will soon unfurl you might also like  now the time is here for iron man to spread fear vengeance from the grave kills the people he once saved  nobody wants him they just turn their heads nobody helps him now he has his revenge  heavy boots of lead fills his victims full of dread running as fast as they can iron man lives again ,https://images.genius.com/46514480a048fb777f012318a43be54f.1000x1000x1.jpg,male,rock
2,Black Sabbath,War Pigs,War Pigs by Black Sabbath,1970-09-18,1970,9,18.0,432582,https://genius.com/Black-sabbath-war-pigs-lyrics,0,1,4,  generals gathered in their masses just like witches at black masses evil minds that plot destruction sorcerer of deaths construction in the fields the bodies burning as the war machine keeps turning death and hatred to mankind poisoning their brainwashed minds  oh lord yeah  politicians hide themselves away they only started the war why should they go out to fight they leave that all to the poor yeah time will tell on their power minds making war just for fun treating people just like pawns in chess wait till their judgment day comes yeah you might also like now in darkness world stops turning ashes where their bodies burning no more war pigs have the power hand of god has struck the hour day of judgment god is calling on their knees the war pigs crawling begging mercies for their sins satan laughing spreads his wings  oh lord yeah ,https://images.genius.com/46514480a048fb777f012318a43be54f.1000x1000x1.jpg,male,rock
3,Black Sabbath,N.I.B.,N.I.B. by Black Sabbath,1970-02-13,1970,2,13.0,206571,https://genius.com/Black-sabbath-nib-lyrics,0,1,4,  oh yeah some people say my love cannot be true please believe me my love and ill show you i will give you those things you thought unreal the sun the moon the stars all bear my seal  oh yeah follow me now and you will not regret leaving the life you led before we met you are the first to have this love of mine forever with me till the end of time  your love for me has just got to be real before you know the way im going to feel im going to feel im going to feel  oh yeah now i have you with me under my power our love grows stronger now with every hour look into my eyes youll see who i am my name is lucifer please take my hand you might also like  oh yeah follow me now and you will not regret leaving the life you led before we met you are the first to have this love of mine forever with me till the end of time  your love for me has just got to be real before you know the way im going to feel im going to feel im going to feel  oh yeah now i have you with me under my power our love grows stronger now with every hour look into my eyes youll see who i am my name is lucifer please take my hand,https://images.genius.com/46514480a048fb777f012318a43be54f.1000x1000x1.jpg,male,rock
4,Black Sabbath,Black Sabbath,Black Sabbath by Black Sabbath,1970-02-13,1970,2,13.0,201318,https://genius.com/Black-sabbath-black-sabbath-lyrics,0,1,4,  what is this that stands before me figure in black which points at me turn round quick and start to run find out im the chosen one oh no  big black shape with eyes of fire tellin people their desire satans sittin there hes smilin watches those flames get higher and higher oh no no please god help me  is it the end my friend satans comin round the bend people runnin cause theyre scared the people better go and beware no no please no you might also like,https://images.genius.com/46514480a048fb777f012318a43be54f.1000x1000x1.jpg,male,rock
5,Black Sabbath,Heaven and Hell,Heaven and Hell by Black Sabbath,1980-04-21,1980,4,21.0,178085,https://genius.com/Black-sabbath-heaven-and-hell-lyrics,0,1,4,  sing me a song youre a singer do me a wrong youre a bringer of evil the devil is never a maker the less that you give youre a taker  so its on and on and on its heaven and hell oh well yeah  the lover of lifes not a sinner the ending is just a beginner the closer you get to the meaning the sooner youll know that youre dreaming  so its on and on and on oh its on and on and on it goes on and on and on heaven and hell i can tell fool fool you might also like ohoh oh oohooh ooh yeahyeah yeah  well if it seems to be real its illusion for every moment of truth theres confusion in life love can be seen as the answer but nobody bleeds for the dancer  and its on and on on and on and on and on and on and on and on and on   they say that lifes a carousel spinning fast you gotta ride it well the world is full of kings and queens who blind your eyes and steal your dreams its heaven and hell oh well and theyll tell you black is really white the moon is just the sun at night and when you walk in golden halls you get to keep the gold that falls its heaven and hell oh no fool fool youve got to bleed for the dancer fool fool look for the answer fool fool fool ,https://images.genius.com/46514480a048fb777f012318a43be54f.1000x1000x1.jpg,male,rock
6,Black Sabbath,Changes,Changes by Black Sabbath,1972-09-25,1972,9,25.0,168313,https://genius.com/Black-sabbath-changes-lyrics,0,2,4, i feel unhappy i feel so sad ive lost the best friend that i ever had she was my woman i loved her so but its too late now ive let her go  im going through changes im going through changes  we shared the years we shared each day in love together we found the way but soon the world had its evil way my heart was blinded love went astray  im going through changes im going through changes  it took so long to realise and i can still hear her last goodbyes now all my days are filled with tears wish i could go back and change these years you might also like im going through changes im going through changes,https://images.genius.com/46514480a048fb777f012318a43be54f.1000x1000x1.jpg,male,rock
7,Black Sabbath,Planet Caravan,Planet Caravan by Black Sabbath,1970-09-18,1970,9,18.0,134224,https://genius.com/Black-sabbath-planet-caravan-lyrics,0,1,4, we sail through endless skies stars shine like eyes the black night sighs the moon in silver dreams pours down in beams light of the night the earth a purple blaze of sapphire haze in orbit always  while down below the trees bathed in cool breeze silver starlight breaks dawn from night and so we pass on by the crimson eye of great god mars as we travel the universe you might also like,https://images.genius.com/46514480a048fb777f012318a43be54f.1000x1000x1.jpg,male,rock
8,Black Sabbath,Sabbath Bloody Sabbath,Sabbath Bloody Sabbath by Black Sabbath,1973-12-01,1973,12,1.0,91146,https://genius.com/Black-sabbath-sabbath-bloody-sabbath-lyrics,0,1,4, youve seen right through distorted eyes you know you had to learn the execution of your mind you really had to turn the race is run the book is read the end begins to show the truth is out the lies are old but you dont want to know  nobody will ever let you know when you ask the reasons why they just tell you that youre on your own fill your head all full of lies  the people who have crippled you you wanna see them burn the gates of life have closed on you and theres just no return youre wishing that the hands of doom could take your mind away and you dont care if you dont see again the light of day  nobody will ever let you know when you ask the reasons why they just tell you that youre on your own fill your head all full of lies you bastards  you might also like where can you run to what more can you do no more tomorrow life is killing you dreams turn to nightmares heaven turns to hell burnt out confusion nothing more to tell yeah everything around you whats it coming to god knows as your dog nose bog blast all of you sabbath bloody sabbath nothing more to do living just for dying dying just for you yeah,https://images.genius.com/46514480a048fb777f012318a43be54f.1000x1000x1.jpg,male,rock
9,Black Sabbath,Sweet Leaf,Sweet Leaf by Black Sabbath,1971-07-21,1971,7,21.0,88112,https://genius.com/Black-sabbath-sweet-leaf-lyrics,0,1,4, *coughing*  alright now wont you listen when i first met you didnt realise i cant forget you or your surprise you introduced me to my mind and left me wanting you and your kind oh yeah  i love you oh you know it my life was empty forever on a down until you took me showed me around my life is free now my life is clear i love you sweet leaf though you cant hear oh yeah   come on now try it out straight people dont know what youre about they put you down and shut you out you gave to me a new belief and soon the world will love you sweet leaf oh yeah baby you might also like come on now oh yeah try me out baby alright oh yeahah i want you part of this sweet leaf oh yeah alright yeah yeah yeah ohoh try me out i love you sweet leaf oh,https://images.genius.com/46514480a048fb777f012318a43be54f.1000x1000x1.jpg,male,rock
10,Black Sabbath,Fairies Wear Boots,Fairies Wear Boots by Black Sabbath,1970-09-18,1970,9,18.0,86274,https://genius.com/Black-sabbath-fairies-wear-boots-lyrics,0,1,4,"  goin home late last night suddenly i got a fright yeah i looked through a window and surprised what i saw fairy with boots are dancin with a dwarf alright now  yeah fairies wear boots and you gotta believe me yeah i saw it i saw it i tell you no lies yeah fairies wear boots and you gotta believe me i saw it i saw it with my own two eyes alright now  yeah fairies wear boots and you gotta believe me yeah i saw it i saw it i tell you no lies yeah fairies wear boots and you gotta believe me i saw it i saw it with my own two eyes alright now  so i went to the doctor see what he could give me he said ""son son youve gone too far cause smokin and trippin is all that you do"" yeahyou might also like",https://images.genius.com/46514480a048fb777f012318a43be54f.1000x1000x1.jpg,male,rock
11,Black Sabbath,Children of the Grave,Children of the Grave by Black Sabbath,1971-07-21,1971,7,21.0,84248,https://genius.com/Black-sabbath-children-of-the-grave-lyrics,0,1,4,  revolution in their minds the children start to march against the world in which they have to live and all the hate thats in their hearts theyre tired of being pushed around and told just what to do theyll fight the world until theyve won and love comes flowing through yeah  children of tomorrow live in the tears that fall today will the sunrise of tomorrow bring in peace in any way must the world live in the shadow of atomic fear can they win the fight for peace or will they disappear yeah  you might also like so you children of the world listen to what i say if you want a better place to live in spread the word today show the world that love is still alive you must be brave or you children of today are children of the grave yeah   children of the grave children of the grave children of the grave,https://images.genius.com/46514480a048fb777f012318a43be54f.1000x1000x1.jpg,male,rock
12,Black Sabbath,Electric Funeral,Electric Funeral by Black Sabbath,1970-09-18,1970,9,18.0,72278,https://genius.com/Black-sabbath-electric-funeral-lyrics,0,1,4, reflex in the sky warn you youre gonna die storm coming you better hide from the atomic tide flashes in the sky turns houses into sties turns people into clay radiation minds decay  robot minds of robot slaves lead them to atomic graves plastic flowers melting sun fading moon falls upon dying world of radiation victims of mad frustration burning globe of obscene fire like electric funeral pyre  buildings crashing down to earths cracking ground rivers turn to wood ice melt into blood earth lies in deathbed clouds cry for the dead terrifying rain is a burning pain electric funeral electric funeral electric funeral electric funeral you might also like and so in the sky shines the electric eye supernatural king takes earth under his wing heavens golden chorus sings hells angels flap their wings evil souls fall to hell ever trapped in burning cells ,https://images.genius.com/46514480a048fb777f012318a43be54f.1000x1000x1.jpg,male,rock
13,Black Sabbath,Hand of Doom,Hand of Doom by Black Sabbath,1970-09-18,1970,9,18.0,65397,https://genius.com/Black-sabbath-hand-of-doom-lyrics,0,1,4, what you gonna do times caught up with you now you wait your turn you know theres no return take your routine roles you join the other fools turn to something new now its killing you  first it was the bomb vietnam napalm disillusioning you push the needle in from life you escape realitys black drape colours in your mind satisfy your time  oh you you know you must be blind to do such things like this to take the sweet that you dont know youre giving death a kiss poor little fool now your mind is full of pleasure your bodys looking ill to you its shallow leisure so drop the acid pill dont stop to think now you might also like youre having a good time baby but that wont last your minds all full of things youre living too fast go out enjoy yourself dont bottle it in you need someone to help you stick the needle in yeah   now you know the scene your skin starts turning green your eyes no longer see lifes reality push the needle in face deaths sickly grin holes are in your skin caused by deadly pin  head starts spinning round you fall down to the ground feel your body heave death hand starts to weave its too late to turn you dont wanna learn price of life you hide now youre gonna die,https://images.genius.com/46514480a048fb777f012318a43be54f.1000x1000x1.jpg,male,rock
14,Black Sabbath,Snowblind,Snowblind by Black Sabbath,1972-09-25,1972,9,25.0,64795,https://genius.com/Black-sabbath-snowblind-lyrics,0,1,4, what you get and what you see things that don’t come easily feeling happy in my pain icicles within my brain cocaine  something blowing in my head winds of ice that soon will spread down to freeze my very soul makes me happy makes me cold  my eyes are blind but i can see the snowflakes glisten on the trees the sun no longer sets me free i feel the snowflakes freezing me   let the winter sun shine on let me feel the frost of dawn build my dreams on flakes of snow soon i’ll feel the chilling glow you might also like right don’t you think i know what i’m doing don’t tell me that it’s doing me wrong you’re the one that’s really the loser this is where i feel i belong right  crystal world with winter flowers turn my days to frozen hours lying snowblind in the sun will my ice age ever come ,https://images.genius.com/46514480a048fb777f012318a43be54f.1000x1000x1.jpg,male,rock
15,Black Sabbath,God Is Dead?,God Is Dead? by Black Sabbath,2013-04-19,2013,4,19.0,62813,https://genius.com/Black-sabbath-god-is-dead-lyrics,0,1,3, lost in the darkness i fade from the light faith of my father my brother my maker and savior help me make it through the night blood on my conscience and murder in mind out of the gloom i rise up from my tomb into impending doom now my body is my shrine  the blood runs free the rain turns red give me the wine you keep the bread the voices echo in my head is god alive or is god dead is god dead  rivers of evil run through dying land swimming in sorrow they kill steal and borrow there is no tomorrow for the sinners will be damned ashes to ashes you cannot exhume a soul who do you trust when corruption and lust creed of all the unjust leaves you empty and unwhole you might also like when will this nightmare be over tell me when can i empty my head will someone tell me the answer is god really dead is god really dead  to safeguard my philosophy until my dying breath i transfer from reality into a living death i empathize with enemies until the timing’s right with god and satan at my side from darkness will come light  i watch the rain as it turns red give me more wine i don’t need bread these riddles that live in my head i don’t believe that god is dead god is dead nowhere to run nowhere to hide wondering if we will meet again on the other side do you believe a word what the good book said or is it just a holy fairytale and god is dead god is dead god is dead god is dead god is dead right   but still the voices in my head are telling me that god is dead the blood pours down the rain turns red i don’t believe that god is dead god is dead god is dead god is dead god is dead,https://images.genius.com/46514480a048fb777f012318a43be54f.1000x1000x1.jpg,male,rock
16,Black Sabbath,Warning,Warning by Black Sabbath,1970-02-13,1970,2,13.0,59127,https://genius.com/Black-sabbath-warning-lyrics,0,1,4, now the first day that i met ya i was looking in the sky when the sun turned all a blur and the thunderclouds rolled by the sea began to shiver and the wind began to moan it mustve been a sign for me to leave you well alone  i was born without you baby but my feelings were a little bit too strong  you never said you love me and i dont believe you can cause i saw you in a dream and you were with another man you looked so cool and casual and i tried to look the same but now ive got to love ya tell me who have i to blame  i was born without you baby but my feelings were a little bit too strong you might also like  now the whole wide world is movin cause theres iron in my heart i just cant keep from cryin cause you say weve got to part sorrow grips my voice as i stand here all alone and watch you slowly take away a love ive never known  i was born without you baby but my feelings were a little bit too strong just a little bit too strong  now the whole wide world is movin cause theres iron in my heart i just cant keep from cryin cause you say weve got to part sorrow grips my voice as i stand here all alone and watch you slowly take away a love ive never known i was born without you baby but my feelings were a little bit too strong just a little bit too strong,https://images.genius.com/46514480a048fb777f012318a43be54f.1000x1000x1.jpg,male,rock
17,Black Sabbath,Solitude,Solitude by Black Sabbath,1971-07-21,1971,7,21.0,58931,https://genius.com/Black-sabbath-solitude-lyrics,0,1,4, my name it means nothing my fortune is less my future is shrouded in dark wilderness sunshine is far away clouds linger on everything i possessed now they are gone they are gone they are gone  oh where can i go to and what can i do nothing can please me only thoughts are of you you just laughed when i begged you to stay ive not stopped crying since you went away you went away you went away  the world is a lonely place youre on your own guess i will go home sit down and moan crying and thinking is all that i do memories i have remind me of you of you of youyou might also like,https://images.genius.com/46514480a048fb777f012318a43be54f.1000x1000x1.jpg,male,rock
18,Black Sabbath,The Wizard,The Wizard by Black Sabbath,1970-02-13,1970,2,13.0,58557,https://genius.com/Black-sabbath-the-wizard-lyrics,0,1,4, misty morning clouds in the sky without warning a wizard walks by casting his shadow weaving his spell long grey cloak tinkling bell  never talking just keeps walking spreading his magic  evil power disappears demons worry when the wizard is near he turns tears into joy everyones happy when the wizard walks by  never talking just keeps walking spreading his magic  sun is shining clouds have gone by all the people give a happy sigh he has passed by giving his sign left all the people feeling so fine you might also like never talking just keeps walking spreading his magic,https://images.genius.com/46514480a048fb777f012318a43be54f.1000x1000x1.jpg,male,rock
19,Black Sabbath,Into the Void,Into the Void by Black Sabbath,1971-07-21,1971,7,21.0,58275,https://genius.com/Black-sabbath-into-the-void-lyrics,0,1,4,  rocket engines burning fuel so fast up into the night sky they blast through the universe the engines whine could it be the end of man and time back on earth the flame of life burns low everywhere is misery and woe pollution kills the air the land and sea man prepares to meet his destiny yeah  rocket engines burning fuel so fast up into the black sky so vast burning metal through the atmosphere earth remains in worry hate and fear with the hateful battles raging on rockets flying to the glowing sun through the empires of eternal void freedom from the final suicide  freedom fighters sent out to the sun escape from brainwashed minds and pollution leave the earth to all its sin and hate find another world where freedom waits yeah you might also like past the stars in fields of ancient void through the shields of darkness where they find love upon a land a world unknown where the sons of freedom make their home leave the earth to satan and his slaves leave them to their future in their grave make a home where love is there to stay peace and happiness in every day,https://images.genius.com/46514480a048fb777f012318a43be54f.1000x1000x1.jpg,male,rock
20,Deep Purple,Smoke on the Water,Smoke on the Water by Deep Purple,1972-03-25,1972,3,25.0,205554,https://genius.com/Deep-purple-smoke-on-the-water-lyrics,0,1,5,  we all came out to montreux on the lake geneva shoreline to make records with a mobile we didnt have much time but frank zappa and the mothers were at the best place around but some stupid with a flare gun burned the place to the ground  smoke on the water and fire in the sky smoke on the water  they burned down the gambling house it died with an awful sound funky claude was running in and out pulling kids out the ground when it all was over we had to find another place but swiss time was running out it seemed that we would lose the race you might also like smoke on the water and fire in the sky smoke on the water  we ended up at the grand hotel it was empty cold and bare but with the rollingtruckstonesthing just outside making our music there with a few red lights a few old beds we made a place to sweat no matter what we get out of this i know i know well never forget  smoke on the water and fire in the sky smoke on the water ,https://images.genius.com/27f921ca0c04b8434e0d0f21aa4cc89f.371x371x1.jpg,male,rock
21,Deep Purple,Soldier of Fortune,Soldier of Fortune by Deep Purple,,1974,11,,80704,https://genius.com/Deep-purple-soldier-of-fortune-lyrics,0,2,2," i have often told you stories about the way i lived the life of a drifter waiting for the day when id take your hand and sing you songs then maybe you would say ""come lay with me and love me"" and i would surely stay  but i feel im growing older and the songs that i have sung echo in the distance like the sound of a windmill going around i guess ill always be a soldier of fortune  many times ive been a traveler i looked for something new in days of old when nights were cold i wandered without you but those days i thought my eyes had seen you standing near though blindness is confusing it shows that youre not here you might also like now i feel im growing older and the songs that i have sung echo in the distance like the sound of a windmill going around i guess ill always be a soldier of fortune  yes i can hear the sound of a windmill going around i guess ill always be a soldier of fortune i guess ill always be a soldier of fortune",https://images.genius.com/27f921ca0c04b8434e0d0f21aa4cc89f.371x371x1.jpg,male,rock
