,Artist,Song Title,Full Title,Release Date,Year,Month,Day,Pageviews,url,featured_count,producer_count,writer_count,Song Lyrics,Artist Image,gender,genre
42,Foo Fighters,The Pretender,The Pretender by Foo Fighters,2007-08-21,2007,8,21.0,366869,https://genius.com/Foo-fighters-the-pretender-lyrics,0,1,4, keep you in the dark you know they all pretend keep you in the dark and so it all began  send in your skeletons sing as their bones go marchin in again the need you buried deep the secrets that you keep are ever ready are you ready im finished makin sense done pleading ignorance that whole defense spinning infinity boy the wheel is spinnin me its never ending never ending same old story  what if i say im not like the others what if i say im not just another one of your plays youre the pretender what if i say i will never surrender what if i say im not like the others what if i say im not just another one of your plays youre the pretender what if i say that ill never surrender you might also like in time or so im told im just another soul for sale oh well the page is out of print we are not permanent were temporary temporary same old story  what if i say im not like the others what if i say im not just another one of your plays youre the pretender what if i say i will never surrender what if i say im not like the others what if i say im not just another one of your plays youre the pretender what if i say i will never surrender oh  im the voice inside your head you refuse to hear im the face that you have to face mirrorin your stare im whats left im whats right im the enemy im the hand thatll take you down bring you to your knees so who are you yeah who are you yeah who are you yeah who are you keep you in the dark you know they all pretend what if i say im not like the others what if i say im not just another one of your plays youre the pretender what if i say i will never surrender what if i say im not like the others what if i say im not just another one of your plays youre the pretender what if i say i will never surrender what if i say im not like the others keep you in the dark what if i say im not just another one of your plays you know they all youre the pretender pretend what if i say i will never surrender what if i say im not like the others keep you in the dark what if i say im not just another one of your plays you know they all youre the pretender pretend what if i say i will never surrender so who are you yeah who are you yeah who are you,https://images.genius.com/183fc4cb23c5dc92a9fda9e7dfef58c7.580x580x1.jpg,male,rock
43,Foo Fighters,All My Life,All My Life by Foo Fighters,2002-09-24,2002,9,24.0,337629,https://genius.com/Foo-fighters-all-my-life-lyrics,0,2,4, all my life ive been searchin for somethin somethin never comes never leads to nothin nothin satisfies but im gettin close closer to the prize at the end of the rope all night long i dream of the day when it comes around then its taken away leaves me with the feelin that i feel the most feel it come to life when i see your ghost  come down dont you resist youve such a delicate wrist and if i give it a twist somethin to hold when i lose my grip will i find somethin in there to give me just what i need another reason to bleed one by one hidden up my sleeve one by one hidden up my sleeve  hey dont let it go to waste i love it but i hate the taste weight keepin me down hey dont let it go to waste i love it but i hate the taste weight keepin me down you might also like will i find a believer another one who believes another one to deceive over and over down on my knees if i get any closer and if you open up wide and if you let me inside on and on i got nothin to hide on and on i got nothin to hide  hey dont let it go to waste i love it but i hate the taste weight keepin me down hey dont let it go to waste i love it but i hate the taste weight keepin me down  all my life ive been searchin for somethin somethin never comes never leads to nothin nothin satisfies but im gettin close closer to the prize at the end of the rope all night long i dream of the day when it comes around then its taken away leaves me with the feelin that i feel the most feel it come to life when i see your ghost then im done done on to the next one done done and im on to the next one done done and im on to the next one done done and im on to the next one done done and im on to the next one done done and im on to the next one done done and im on to the next one done im done and im on to the next done done on to the next one done im done and im on to the next one done done on to the next one done im done and im on to the next  hey dont let it go to waste i love it but i hate the taste weight keepin me down hey dont let it go to waste i love it but i hate the taste weight keepin me down  done done on to the next one done and im done and im on to the next,https://images.genius.com/183fc4cb23c5dc92a9fda9e7dfef58c7.580x580x1.jpg,male,rock
44,Foo Fighters,Best of You,Best of You by Foo Fighters,2005-05-30,2005,5,30.0,275405,https://genius.com/Foo-fighters-best-of-you-lyrics,0,2,4, ive got another confession to make im your fool everyones got their chains to break holdin you were you born to resist or be abused  is someone getting the best the best the best the best of you is someone getting the best the best the best the best of you are you gone and on to someone new  i needed somewhere to hang my head without your noose you gave me something that i didnt have but had no use i was too weak to give in too strong to lose my heart is under arrest again but i break loose my head is giving me life or death but i cant choose i swear ill never give in i refuse you might also like is someone getting the best the best the best the best of you is someone getting the best the best the best the best of you has someone taken your faith its real the pain you feel you trust you must confess is someone getting the best the best the best the best of you oh oh oh oh oh  has someone taken your faith its real the pain you feel the life the love youd die to heal the hope that starts the broken hearts you trust you must confess is someone getting the best the best the best the best of you is someone getting the best the best the best the best of you ive got another confession my friend im no fool im getting tired of starting again somewhere new were you born to resist or be abused i swear ill never give in i refuse  is someone getting the best the best the best the best of you is someone getting the best the best the best the best of you has someone taken your faith its real the pain you feel you trust you must confess is someone getting the best the best the best the best of you oh,https://images.genius.com/183fc4cb23c5dc92a9fda9e7dfef58c7.580x580x1.jpg,male,rock
45,Foo Fighters,Learn to Fly,Learn to Fly by Foo Fighters,1999-09-18,1999,9,18.0,231342,https://genius.com/Foo-fighters-learn-to-fly-lyrics,0,2,3, run and tell all of the angels this could take all night think i need a devil to help me get things right hook me up a new revolution cause this one is a lie we sat around laughin and watched the last one die  now im lookin to the sky to save me lookin for a sign of life lookin for something to help me burn out bright im lookin for a complication lookin cause im tired of lyin make my way back home when i learn to fly high  i think im done nursin the patience it can wait one night id give it all away if you give me one last try well live happily ever trapped if you just save my life run and tell the angels that everythings all right  now im lookin to the sky to save me im lookin for a sign of life lookin for something to help me burn out bright im lookin for a complication lookin cause im tired of tryin make my way back home when i learn to fly high make my way back home when i learn to  fly along with me i cant quite make it alone try to make this life my own fly along with me i cant quite make it alone try to make this life my own you might also like im lookin to the sky to save me im lookin for a sign of life lookin for something to help me burn out bright im lookin for a complication lookin cause im tired of tryin make my way back home when i learn to lookin to the sky to save me im lookin for a sign of life lookin for something to help me burn out bright im lookin for a complication lookin cause im tired of tryin make my way back home when i learn to fly high make my way back home when i learn to fly make my way back home when i learn to,https://images.genius.com/183fc4cb23c5dc92a9fda9e7dfef58c7.580x580x1.jpg,male,rock
46,Foo Fighters,The Sky Is a Neighborhood,The Sky Is a Neighborhood by Foo Fighters,2017-08-23,2017,8,23.0,201863,https://genius.com/Foo-fighters-the-sky-is-a-neighborhood-lyrics,0,1,6, ahah ahah ahahahah  the sky is a neighborhood so keep it down heart is a storybook a star burned out the sky is a neighborhood dont make a sound lights comin up ahead dont look now  the sky is a neighborhood ahah ahah the sky is a neighborhood ahah ahah dont look now  oh my dear heaven is a big bang now gotta get to sleep somehow bangin on the ceiling bangin on the ceiling keep it down oh my dear heaven is a big bang now gotta get to sleep somehow bangin on the ceiling bangin on the ceiling keep it down  mind is a battlefield all hope is gone trouble to the right and left whose side youre on thoughts like a minefield im a tickin bomb maybe you should watch your step dont get lost you might also like the sky is a neighborhood ahah ahah the sky is a neighborhood ahah ahah dont get lost  oh my dear heaven is a big bang now gotta get to sleep somehow bangin on the ceiling bangin on the ceiling keep it down oh my dear heaven is a big bang now gotta get to sleep somehow bangin on the ceiling bangin on the ceiling keep it down  the sky is a neighborhood  heart is a storybook a star burned out something comin up ahead dont look now  oh my dear heaven is a big bang now gotta get to sleep somehow bangin on the ceiling bangin on the ceiling keep it down oh my dear heaven is a big bang now gotta get to sleep somehow bangin on the ceiling bangin on the ceiling keep it down the sky is a neighborhood oh my dear heaven is a big bang now gotta get to sleep somehow the sky is a neighborhood bangin on the ceiling bangin on the ceiling keep it down the sky is a neighborhood,https://images.genius.com/183fc4cb23c5dc92a9fda9e7dfef58c7.580x580x1.jpg,male,rock
47,Foo Fighters,Run,Run by Foo Fighters,2017-06-01,2017,6,1.0,175337,https://genius.com/Foo-fighters-run-lyrics,0,1,6, wake up run for your life with me wake up run for your life with me  in another perfect life in another perfect light we run we run we run  the rats are on parade another mad charade what you gonna do the hounds are on the chase everythings erased what you gonna do i need some room to breathe you can stay asleep if you wanted to they say thats nothings free you can run with me if you wanted to yeah you can run with me if you wanted to  before the time runs out theres somewhere to run wake up run for your life with me wake up run for your life with me you might also like in another perfect life in another perfect light we run we run we run run  we are the nations stakes if everythings erased what you gonna do i need some room to breathe you can run with me if you wanted to yeah you can run with me if you wanted to  before the time runs out theres somewhere to run wake up run for your life with me wake up run for your life with me  in another perfect life in another perfect light we run we run we run run  wake up run for your life with me wake up run for your life with me  in another perfect life in another perfect light we run we run we run run,https://images.genius.com/183fc4cb23c5dc92a9fda9e7dfef58c7.580x580x1.jpg,male,rock
48,Foo Fighters,Monkey Wrench,Monkey Wrench by Foo Fighters,1997-04-28,1997,4,28.0,146729,https://genius.com/Foo-fighters-monkey-wrench-lyrics,0,1,3, what have we done with innocence it disappeared with time it never made much sense adolescent resident wasting another night on plannin my revenge  one in ten one in ten one in ten  dont wanna be your monkey wrench one more indecent accident id rather leave than suffer this ill never be your monkey wrench  all this time to make amends what do you do when all your enemies are friends now and then ill try to bend under pressure wind up snapping in the end  one in ten one in ten one in ten you might also like dont wanna be your monkey wrench one more indecent accident id rather leave than suffer this ill never be your monkey wrench  temper temper temper one last thing before i quit i never wanted any more than i could fit into my head i still remember every single word you said and all the shit that somehow came along with it still theres one thing that comforts me since i was always caged and now im free  dont wanna be your monkey wrench one more indecent accident id rather leave than suffer this ill never be your monkey wrench dont wanna be your monkey wrench fall in fall out dont wanna be your monkey wrench fall in fall out dont wanna be your monkey wrench fall in fall out dont wanna be your monkey wrench,https://images.genius.com/183fc4cb23c5dc92a9fda9e7dfef58c7.580x580x1.jpg,male,rock
49,Foo Fighters,Times Like These,Times Like These by Foo Fighters,2003-01-14,2003,1,14.0,144519,https://genius.com/Foo-fighters-times-like-these-lyrics,0,2,4,  i im a one way motorway im the one that drives away and follows you back home i im a streetlight shinin im a white light blindin bright burnin off and on uhuh  its times like these you learn to live again its times like these you give and give again its times like these you learn to love again its times like these time and time again  i im a new day risin im a brand new sky to hang the stars upon tonight but i im a little divided do i stay or run away and leave it all behind uhuh  its times like these you learn to live again its times like these you give and give again its times like these you learn to love again its times like these time and time again you might also like  uhuh uhuh uhuh  its times like these you learn to live again its times like these you give and give again its times like these you learn to love again its times like these time and time again its times like these you learn to live again its times like these you give and give again its times like these you learn to love again its times like these time and time again  its times like these you learn to live again its times like these you give and give again its times like these you learn to love again its times like these time and time again,https://images.genius.com/183fc4cb23c5dc92a9fda9e7dfef58c7.580x580x1.jpg,male,rock
50,Foo Fighters,Walk,Walk by Foo Fighters,2011-06-17,2011,6,17.0,128106,https://genius.com/Foo-fighters-walk-lyrics,0,1,5, a million miles away your signal in the distance to whom it may concern i think i lost my way gettin good at startin over every time that i return  learnin to walk again i believe ive waited long enough where do i begin learnin to talk again cant you see ive waited long enough where do i begin  do you remember the days we built these paper mountains then sat and watched them burn i think i found my place cant you feel it growin stronger little conquerors  learnin to walk again i believe ive waited long enough where do i begin learnin to talk again i believe ive waited long enough where do i begin you might also like now for the very first time dont you pay no mind set me free again to keep alive a moment at a time but still inside a whisper to a riot to sacrifice but knowin to survive the first to climb another state of mind im on my knees im prayin for a sign forever whenever i never wanna die i never wanna die i never wanna die im on my knees i never wanna die im dancin on my grave im runnin through the fire forever whenever i never wanna die i never wanna leave ill never say goodbye forever whenever forever whenever  learnin to walk again i believe ive waited long enough where do i begin learnin to talk again cant you see ive waited long enough where do i begin learnin to walk again i believe ive waited long enough learnin to talk again cant you see ive waited long enough,https://images.genius.com/183fc4cb23c5dc92a9fda9e7dfef58c7.580x580x1.jpg,male,rock
51,Foo Fighters,Big Me,Big Me by Foo Fighters,1996-02-25,1996,2,25.0,86895,https://genius.com/Foo-fighters-big-me-lyrics,0,2,1, when i talk about it carries on reasons only knew when i talk about it aries or treasons all renew  big me to talk about it i could stand to prove if we can get around it i know that its true  well i talked about it carried on reasons only knew but its you i fell into  well i talked about it carries on reasons only knew when i talk about it aries or treasons all renew  big me to talk about it i could stand to prove if we can get around it i know that its true you might also like well i talked about it put it on never was it true but its you i fell into  well i talked about it put it on never was it true but its you i fell into i fell into i fell into,https://images.genius.com/183fc4cb23c5dc92a9fda9e7dfef58c7.580x580x1.jpg,male,rock
52,Foo Fighters,These Days,These Days by Foo Fighters,2011-11-01,2011,11,1.0,66685,https://genius.com/Foo-fighters-these-days-lyrics,0,1,5, one of these days the ground will drop out from beneath your feet one of these days your heart will stop and play its final beat  one of these days the clocks will stop and time wont mean a thing one of these days their bombs will drop and silence everything  but its alright yeah its alright said its alright  easy for you to say your heart has never been broken your pride has never been stolen not yet not yet one of these days i bet your heartll be broken i bet your pridell be stolen i bet i bet i bet i bet one of these days one of these days  one of these days your eyes will close and pain will disappear one of these days you will forget to hope and learn to fear you might also like but its alright yeah its alright said its alright  easy for you to say your heart has never been broken your pride has never been stolen not yet not yet one of these days i bet your heartll be broken i bet your pridell be stolen i bet i bet i bet i bet one of these days one of these days  but its alright yeah its alright said its alright yeah its alright dont say its alright dont say its alright dont say its alright  one of these days your heart will stop and play its final beat  but its alright  easy for you to say your heart has never been broken your pride has never been stolen not yet not yet one of these days i bet your heartll be broken i bet your pridell be stolen i bet i bet i bet i bet one of these days one of these days one of these days,https://images.genius.com/183fc4cb23c5dc92a9fda9e7dfef58c7.580x580x1.jpg,male,rock
53,Foo Fighters,I’ll Stick Around,I'll Stick Around by Foo Fighters,1995-09-04,1995,9,4.0,61777,https://genius.com/Foo-fighters-ill-stick-around-lyrics,0,2,1, i thought i knew all it took to bother you every word i said was true and that youll see how could it be im the only one who sees your rehearsed insanity yeah  i still refused all the methods you abused its alright if youre confused let me be ive been around all the pawns youve gagged and bound theyll come back and knock you down and ill be free  ive taken all and ive endured one day it all will fade im sure  i dont owe you anything i dont owe you anything i dont owe you anything i dont owe you anything  i had no hand in your ever desperate plan it returns and when it lands words are due i shouldve known we were better off alone i looked in and i was shown you were too you might also like ive taken all and ive endured one day it all will fade im sure  i dont owe you anything i dont owe you anything i dont owe you anything i dont owe you anything i dont owe you anything i dont owe you anything i dont owe you anything i dont owe you anything  ill stick around ill stick around and learn from all that came from it ill stick around ill stick around and learn from all that came from it ill stick around ill stick around and learn from all that came from it ill stick around ill stick around and learn from all that came from it yeah,https://images.genius.com/183fc4cb23c5dc92a9fda9e7dfef58c7.580x580x1.jpg,male,rock
54,Foo Fighters,This Is a Call,This Is a Call by Foo Fighters,1995-06-19,1995,6,19.0,60746,https://genius.com/Foo-fighters-this-is-a-call-lyrics,0,2,1, visiting is pretty visitin is good seems that all they ever wanted was a brother this can be a secret we can keep it good even all they ever wanted had a problem  this is a call to all my past resignations this is a call to all  fingernails are pretty fingernails are good seems that all they ever wanted was a markin them balloons are pretty big and say they should ever fall to ground call the magic marker  this is a call to all my past resignations this is a call to all this is a call to all my past resignations its been too long   minocin is pretty minocin is good even all the cysts and mollusks tend to barter ritalin is easy ritalin is good even all the ones that watered down the daughter you might also like this is a call to all my past resignations this is a call to all this is a call to all my past resignations its been too long   fingernails are pretty fingernails are good seems that all they ever wanted was a markin them balloons are pretty big and say they should ever fall to ground call the magic marker  this is a call to all my past resignations this is a call to all this is a call to all my past resignations its been too long ,https://images.genius.com/183fc4cb23c5dc92a9fda9e7dfef58c7.580x580x1.jpg,male,rock
55,Foo Fighters,Shame Shame,Shame Shame by Foo Fighters,2020-11-07,2020,11,7.0,52635,https://genius.com/Foo-fighters-shame-shame-lyrics,0,2,6, if you want to ill make you feel something real just to bother you now i got you under my thumb like a drug i will smother you  ill be the one be the moon be the sun be the rain in your song go and put that record on if you want to ill be the one be the tongue that will swallow you  shame shame shame shame shame shame shame shame  another splinter under the skin another season of loneliness i found a reason and buried it beneath a mountain of emptiness  ohohoh ohohoh ohoh ohoh oh ohohoh ohoh oh you might also like shame shame shame shame  who what where when shame shame just move along nothing wrong til we meet again shame shame ill be the end shame shame ill be the war at your door come and let me in shame shame  ill be the one be the moon be the sun shame shame be the rain in your song go put that record on shame shame if you want to shame shame ill be the one be the tongue that will swallow you shame shame  another splinter under the skin another season of loneliness i found a reason and buried it beneath a mountain of emptiness  ohohoh ohohoh ohoh ohoh oh ohohoh ohoh oh shame shame shame shame shame shame shame shame shame shame shame shame shame shame shame shame  another splinter under the skin another season of loneliness i found a reason and buried it beneath a mountain of emptiness  ohohoh ohohoh ohoh ohoh oh ohohoh ohoh oh  shame shame shame shame shame shame shame shame,https://images.genius.com/183fc4cb23c5dc92a9fda9e7dfef58c7.580x580x1.jpg,male,rock
56,Foo Fighters,Rescued,Rescued by Foo Fighters,2023-04-19,2023,4,19.0,49755,https://genius.com/Foo-fighters-rescued-lyrics,0,2,5, it came in a flash it came outta nowhere it happened so fast and then it was over  oh are you thinkin what im thinkin is this happenin now oh are you feelin what im feelin this is happenin now  were all free to some degree to dance under the lights im just waitin to be rescued bring me back to life kings and queens and inbetweens we all deserve the right im just waitin to be rescued im just waitin to be rescued were all just waitin to be rescued tonight  i fell in a trap my hеarts gettin colder its comin on fast its over my shouldеr  oh are you thinkin what im thinkin is this happenin now oh are you feelin what im feelin this is happenin now you might also like were all free to some degree to dance under the lights im just waitin to be rescued bring me back to life kings and queens and inbetweens we all deserve the right im just waitin to be rescued im just waitin to be rescued were all just waitin to be rescued tonight  to be rescued tonight rescue me tonight rescue me tonight  were all free to some degree to dance under the lights im just waitin to be rescued bring me back to life kings and queens and inbetweens we all deserve the right im just waitin to be rescued im just waitin to be rescued were all just waitin to be rescued tonight  to be rescued tonight rescue me tonight rescue me tonight,https://images.genius.com/183fc4cb23c5dc92a9fda9e7dfef58c7.580x580x1.jpg,male,rock
