,Artist,Song Title,Full Title,Release Date,Year,Month,Day,Pageviews,url,featured_count,producer_count,writer_count,Song Lyrics,Artist Image,gender,genre
95,Led Zeppelin,The Rain Song,The Rain Song by Led Zeppelin,1973-03-28,1973,3,28.0,120060,https://genius.com/Led-zeppelin-the-rain-song-lyrics,0,1,2, it is the springtime of my loving the second season i am to know you are the sunlight in my growing so little warmth ive felt before it isnt hard to feel me glowing i watched the fire that grew so low oooh oh  it is the summer of my smiles flee from me keepers of the gloom speak to me only with your eyes it is to you i give this tune aint so hard to recognize oh these things are clear to all from time to time ooh oh oh  ah talk talk talk talk hey  ive felt the coldness of my winter i never thought it would ever go i cursed the gloom that set upon us upon us upon us but i know that i love you so ohhhh oh but i know that i love you so you might also like these are the seasons of emotion and like the wind they rise and fall this is the wonder of devotion i see the torch we all must hold this is the mystery of the quotient quotient ah upon us all upon us all a little rain must fall  just a little rain oh yeah uhh ooooh yeah yeah yeah,https://images.genius.com/e4763bba12e6411077a3e573cd290da0.433x433x1.jpg,male,rock
96,Led Zeppelin,Over the Hills and Far Away,Over the Hills and Far Away by Led Zeppelin,1973-05-24,1973,5,24.0,119328,https://genius.com/Led-zeppelin-over-the-hills-and-far-away-lyrics,0,1,2,  hey lady you got the love i need maybe more than enough oh darling darling darling walk a while with me oh youve got so much so much so much many have i loved and many times been bitten many times ive gazed along the open road many times ive lied and many times ive listened many times ive wondered how much there is to know many dreams come true and some have silver linings i live for my dream and a pocketful of gold   mellow is the man who knows what hes been missing many many men cant see the open road many is a word that only leaves you guessing guessing bout a thing you really ought to know oh oh oh oh really ought to know oh oh oh i really ought to know ohwhoa you know i should you know i should you know i shouldve known ooohhhyou might also like,https://images.genius.com/e4763bba12e6411077a3e573cd290da0.433x433x1.jpg,male,rock
97,Led Zeppelin,Rock and Roll,Rock and Roll by Led Zeppelin,1971-11-08,1971,11,8.0,114572,https://genius.com/Led-zeppelin-rock-and-roll-lyrics,0,1,4, its been a long time since i rock and rolled its been a long time since i did the stroll ooh let me get it back let me get it back let me get it back baby where i come from  its been a long time been a long time been a long lonely lonely lonely lonely lonely time yes it has  its been a long time since the book of love i cant count the tears of a life with no love carry me back carry me back carry me back baby where i come from whoa whoa oh  its been a long time been a long time been a long lonely lonely lonely lonely lonely time  ahhh  ahhh  oh seems so long since we walked in the moonlight making vows that just cant work right oh yeah open your arms open your arms open your arms baby let my love come running in yeah you might also like its been a long time been a long time been a long lonely lonely lonely lonely lonely time yeah yeah yeah yeah ooh yeah ooh yeah ooh yeah ooh yeah its been a long time been a long time been a long lonely lonely lonely lonely lonely time,https://images.genius.com/e4763bba12e6411077a3e573cd290da0.433x433x1.jpg,male,rock
98,Led Zeppelin,Good Times Bad Times,Good Times Bad Times by Led Zeppelin,1969-01-12,1969,1,12.0,108580,https://genius.com/Led-zeppelin-good-times-bad-times-lyrics,0,1,3, in the days of my youth i was told what it means to be a man now ive reached that age ive tried to do all those things the best i can no matter how i try i find my way into the same old jam  good times bad times you know ive had my share when my woman left home for a browneyed man but i still dont seem to care  sixteen i fell in love with a girl as sweet as could be it only took a couple of days till she was rid of me she swore that she would be all mine and love me til the end but when i whispered in her ear i lost another friend oh  good times bad times you know ive had my share when my woman left home for a browneyed man but i still dont seem to care   good times bad times you know ive had my share when my woman left home for a browneyed man but i still dont seem to care you might also like i know what it means to be alone i sure do wish i was at home i dont care what the neighbours say im gonna love you each and every day you can feel the beat within my heart realize sweet babe we aint never gonna part i feel good when i look into your eyes,https://images.genius.com/e4763bba12e6411077a3e573cd290da0.433x433x1.jpg,male,rock
99,Led Zeppelin,Heartbreaker,Heartbreaker by Led Zeppelin,1969-10-22,1969,10,22.0,102354,https://genius.com/Led-zeppelin-heartbreaker-lyrics,0,1,4,  hey fellas have you heard the news you know that annies back in town i wont take long just watch and see how the fellas lay their money down her style is new but the face the same as it was so long ago but from her eyes a different smile like that of one who knows  well its been ten years or maybe more since i first set eyes on you the best years of my life gone by here i am alone and blue some people cry and some people die by the wicked ways of love but ill just keep on rollin along with the grace of the lord above  people talkin all around bout the way you left me flat i dont care what the people say i know where their jive is at one thing i do have on my mind if you can clarify please do its the way you call me another guys name when i try to make love to you yeah i try to make love but it aint no use give it to me give it  you might also like mm work so hard i couldnt unwind get some money saved abuse my love a thousand times however hard i tried heartbreaker your time has come cant take your evil way go away heartbreaker  heartbreaker heartbreaker heart,https://images.genius.com/e4763bba12e6411077a3e573cd290da0.433x433x1.jpg,male,rock
100,Nirvana,Smells Like Teen Spirit,Smells Like Teen Spirit by Nirvana,1991-09-10,1991,9,10.0,2923676,https://genius.com/Nirvana-smells-like-teen-spirit-lyrics,0,1,3, load up on guns bring your friends its fun to lose and to pretend shes overbored and selfassured oh no i know a dirty word  hello hello hello how low hello hello hello how low hello hello hello how low hello hello hello  with the lights out its less dangerous here we are now entertain us i feel stupid and contagious here we are now entertain us a mulatto an albino a mosquito my libido  yeah hey yay  im worse at what i do best and for this gift i feel blessed our little group has always been and always will until the end you might also like hello hello hello how low hello hello hello how low hello hello hello how low hello hello hello  with the lights out its less dangerous here we are now entertain us i feel stupid and contagious here we are now entertain us a mulatto an albino a mosquito my libido  yeah hey yay   and i forget just why i taste oh yeah i guess it makes me smile i found it hard its hard to find oh well whatever never mind  hello hello hello how low hello hello hello how low hello hello hello how low hello hello hello with the lights out its less dangerous here we are now entertain us i feel stupid and contagious here we are now entertain us a mulatto an albino a mosquito my libido  a denial a denial a denial a denial a denial a denial a denial a denial a denial,https://images.genius.com/d5f11d1fb2e0c8d803744da555a2b6ae.1000x1000x1.jpg,male,rock
101,Nirvana,Come as You Are,Come as You Are by Nirvana,1992-03-02,1992,3,2.0,1167089,https://genius.com/Nirvana-come-as-you-are-lyrics,0,1,1, come as you are as you were as i want you to be as a friend as a friend as an old enemy take your time hurry up choice is yours dont be late take a rest as a friend as an old memoria  memoria memoria memoria come doused in mud soaked in bleach as i want you to be as a trend as a friend as an old memoria  memoria memoria memoria you might also like and i swear that i dont have a gun no i dont have a gun no i dont have a gun  ria memoria memoria memoria no i dont have a gun  well i swear that i dont have a gun no i dont have a gun no i dont have a gun no i dont have a gun no i dont have a gun  memoria memoria,https://images.genius.com/d5f11d1fb2e0c8d803744da555a2b6ae.1000x1000x1.jpg,male,rock
102,Nirvana,Heart-Shaped Box,Heart-Shaped Box by Nirvana,1993-08-30,1993,8,30.0,1145552,https://genius.com/Nirvana-heart-shaped-box-lyrics,0,1,1, she eyes me like a pisces when i am weak ive been locked inside your heartshaped box for weeks ive been drawn into your magnet tar pit trap i wish i could eat your cancer when you turn black  hey wait i got a new complaint forever in debt to your priceless advice hey wait i got a new complaint forever in debt to your priceless advice hey wait i got a new complaint forever in debt to your priceless advice your advice  meateating orchids forgive no one just yet cut myself on angel hair and babys breath broken hymen of your highness im left black throw down your umbilical noose so i can climb right back  hey wait i got a new complaint forever in debt to your priceless advice hey wait i got a new complaint forever in debt to your priceless advice hey wait i got a new complaint forever in debt to your priceless advice your advice you might also like  she eyes me like a pisces when i am weak ive been locked inside your heartshaped box for weeks ive been drawn into your magnet tar pit trap i wish i could eat your cancer when you turn black  hey wait i got a new complaint forever in debt to your priceless advice hey wait i got a new complaint forever in debt to your priceless advice hey wait i got a new complaint forever in debt to your priceless advice your advice your advice your advice,https://images.genius.com/d5f11d1fb2e0c8d803744da555a2b6ae.1000x1000x1.jpg,male,rock
103,Nirvana,Lithium,Lithium by Nirvana,1992-07-13,1992,7,13.0,1019422,https://genius.com/Nirvana-lithium-lyrics,0,1,1, im so happy cause today i found my friends theyre in my head im so ugly thats okay cause so are you broke our mirrors sunday mornin is every day for all i care and im not scared light my candles in a daze cause ive found god  yeah yeah yeah yeah yeah yeah yeah yeah yeah yeah yeah yeah yeah  im so lonely thats okay i shaved my head and im not sad and just maybe im to blame for all ive heard but im not sure im so excited i cant wait to meet you there and i dont care im so horny thats okay my will is good you might also like yeah yeah yeah yeah yeah yeah yeah yeah yeah yeah yeah yeah yeah  i like it im not gonna crack i miss you im not gonna crack i love you im not gonna crack i killed you im not gonna crack i like it im not gonna crack i miss you im not gonna crack i love you im not gonna crack i killed you im not gonna crack  im so happy cause today i found my friends theyre in my head im so ugly thats okay cause so are you broke our mirrors sunday mornin is every day for all i care and im not scared light my candles in a daze cause ive found god yeah yeah yeah yeah yeah yeah yeah yeah yeah yeah yeah yeah yeah  i like it im not gonna crack i miss you im not gonna crack i love you im not gonna crack i killed you im not gonna crack i like it im not gonna crack i miss you im not gonna crack i love you im not gonna crack i killed you im not gonna crack,https://images.genius.com/d5f11d1fb2e0c8d803744da555a2b6ae.1000x1000x1.jpg,male,rock
104,Nirvana,Polly,Polly by Nirvana,1991-09-24,1991,9,24.0,834927,https://genius.com/Nirvana-polly-lyrics,0,1,1, polly wants a cracker i think i should get off her first i think she wants some water to put out the blow torch  isnt me have a seed let me clip dirty wings let me take a ride cut yourself want some help please myself got some rope have been told promise you have been true let me take a ride cut yourself want some help please myself  polly wants a cracker maybe she would like some food she asked me to untie her a chase would be nice for a few  isnt me have a seed let me clip dirty wings let me take a ride cut yourself want some help please myself got some rope have been told promise you have been true let me take a ride cut yourself want some help please myself you might also like polly said polly says her back hurts shes just as bored as me she caught me off my guard amazes me the will of instinct  isnt me have a seed let me clip dirty wings let me take a ride cut yourself want some help please myself got some rope have been told promise you have been true let me take a ride cut yourself want some help please myself,https://images.genius.com/d5f11d1fb2e0c8d803744da555a2b6ae.1000x1000x1.jpg,male,rock
105,Nirvana,Drain You,Drain You by Nirvana,1991-09-24,1991,9,24.0,771089,https://genius.com/Nirvana-drain-you-lyrics,0,1,1," one baby to another says ""im lucky to have met you"" i dont care what you think unless it is about me it is now my duty to completely drain you i travel through a tube and end up in your infection  chew your meat for you pass it back and forth in a passionate kiss from my mouth to yours  i like you  with eyes so dilated ive become your pupil you taught me everything without a poison apple the water is so yellow im a healthy student indebted and so grateful vacuum out the fluids  chew your meat for you pass it back and forth in a passionate kiss from my mouth to yours you might also like i like you you you you you you you  one baby to another says ""im lucky to have met you"" i dont care what you think unless it is about me it is now my duty to completely drain you i travel through a tube and end up in your infection  chew your meat for you pass it back and forth in a passionate kiss from my mouth to yours sloppy lips to lips youre my vitamins  i like you",https://images.genius.com/d5f11d1fb2e0c8d803744da555a2b6ae.1000x1000x1.jpg,male,rock
106,Nirvana,Something in the Way,Something in the Way by Nirvana,1991-09-24,1991,9,24.0,743500,https://genius.com/Nirvana-something-in-the-way-lyrics,0,1,1, underneath the bridge tarp has sprung a leak and the animals ive trapped have all become my pets and im livin off of grass and the drippings from the ceilin its okay to eat fish cause they dont have any feelings  something in the way mmm something in the way yeah mmm something in the way mmm something in the way yeah mmm something in the way mmm something in the way yeah mmm underneath the bridge tarp has sprung a leak and the animals ive trapped have all become my pets and im livin off of grass and the drippings from the ceilin its okay to eat fish cause they dont have any feelings  something in the way mmm something in the way yeah mmm something in the way mmm something in the way yeah mmm something in the way mmm something in the way yeah mmm something in the way mmm something in the way yeah mmmyou might also like,https://images.genius.com/d5f11d1fb2e0c8d803744da555a2b6ae.1000x1000x1.jpg,male,rock
107,Nirvana,Rape Me,Rape Me by Nirvana,1993-09-13,1993,9,13.0,696395,https://genius.com/Nirvana-rape-me-lyrics,0,1,1, rape me rape me my friend rape me rape me again  im not the only one ahah im not the only one ahah im not the only one ahah im not the only one  hate me do it and do it again waste me rape me my friend  im not the only one ahah im not the only one ahah im not the only one ahah im not the only one  my favorite inside source ill kiss your open sores i appreciate your concern youre gonna stink and burn you might also like rape me rape me my friend rape me rape me again  im not the only one ahah im not the only one ahah im not the only one ahah im not the only one  rape me rape me rape me rape me rape me rape me rape me rape me rape me rape me rape me rape me rape me,https://images.genius.com/d5f11d1fb2e0c8d803744da555a2b6ae.1000x1000x1.jpg,male,rock
108,Nirvana,In Bloom,In Bloom by Nirvana,1992-11-30,1992,11,30.0,683828,https://genius.com/Nirvana-in-bloom-lyrics,0,1,1," sell the kids for food weather changes moods spring is here again reproductive glands  hes the one who likes all our pretty songs and he likes to sing along and he likes to shoot his gun but he knows not what it means knows not what it means and i say hes the one who likes all our pretty songs and he likes to sing along and he likes to shoot his gun but he knows not what it means knows not what it means and i say ""yeah""  we can have some more nature is a whore bruises on the fruit tender age in bloom  hes the one who likes all our pretty songs and he likes to sing along and he likes to shoot his gun but he knows not what it means knows not what it means and i say hes the one who likes all our pretty songs and he likes to sing along and he likes to shoot his gun but he knows not what it means knows not what it means and i say ""yeah"" you might also like  hes the one who likes all our pretty songs and he likes to sing along and he likes to shoot his gun but he knows not what it means knows not what it means and i say hes the one who likes all our pretty songs and he likes to sing along and he likes to shoot his gun but he knows not what it means knows not what it means knows not what it means knows not what it means and i say ""yeah""",https://images.genius.com/d5f11d1fb2e0c8d803744da555a2b6ae.1000x1000x1.jpg,male,rock
109,Nirvana,The Man Who Sold the World,The Man Who Sold the World by Nirvana,1994-11-01,1994,11,1.0,624975,https://genius.com/Nirvana-the-man-who-sold-the-world-lyrics,0,2,1, we passed upon the stairs we spoke of was and when although i wasnt there he said i was his friend which came as a surprise i spoke into his eyes i thought you died alone a long long time ago  oh no not me we never lost control youre face to face with the man who sold the world  i laughed and shook his hand and made my way back home i searched for form and land for years and years i roamed i gazed a gazeless stare we walked a million hills i must have died alone a long long time ago you might also like who knows not me i never lost control youre face to face with the man who sold the world who knows not me we never lost control youre face to face with the man who sold the world   thanks that was a david bowie song whats next i didnt screw it up did i no okay but heres another one i could screw up what is it am i gonna do this by myself yeah you should do it by yourself do it by yourself okay well i think ill try in a different key ill try in a normal key yeah if it sounds bad these people are just gonna have to wait,https://images.genius.com/d5f11d1fb2e0c8d803744da555a2b6ae.1000x1000x1.jpg,male,rock
110,Nirvana,All Apologies,All Apologies by Nirvana,1993-09-13,1993,9,13.0,606322,https://genius.com/Nirvana-all-apologies-lyrics,0,1,1, what else should i be all apologies what else could i say everyone is gay what else could i write i dont have the right what else should i be all apologies  in the sun in the sun i feel as one in the sun in the sun  married buried  i wish i was like you easily amused find my nest of salt everythings my fault ill take all the blame aqua sea foam shame sunburn freezer burn chokin on the ashes of her enemy you might also like in the sun in the sun i feel as one in the sun in the sun  married married married buried yeah yeah yeah yeah  all in all is all we are all in all is all we are all in all is all we are all in all is all we are all in all is all we are all in all is all we are all in all is all we are all in all is all we are all in all is all we are all in all is all we are all in all is all we are all in all is all we are all in all is all we are all in all is all we are all in all is all we are all in all is all we are all in all is all we are all in all is all we are all in all is all we are all in all is all we are all in all is all we are all in all is all we are,https://images.genius.com/d5f11d1fb2e0c8d803744da555a2b6ae.1000x1000x1.jpg,male,rock
111,Nirvana,Lounge Act,Lounge Act by Nirvana,1991-09-24,1991,9,24.0,553685,https://genius.com/Nirvana-lounge-act-lyrics,0,1,1, truth covered insecurity i cant let you smother me id like to but it couldnt work tradin off and takin turns i dont regret a thing  and ive got this friend you see who makes me feel and i wanted more than i could steal ill arrest myself ill wear a shield ill go out of my way to prove i  still smell her on you  dont tell me what i wanna hear afraid of never knowin fear experience anything you need ill keep fightin jealousy until its fucking gone  ive got this friend you see who makes me feel and i wanted more than i could steal ill arrest myself ill wear a shield ill go out of my way to prove i still smell her on you  truth covered insecurity i cant let you smother me id like to but it couldnt work tradin off and takin turns dont regret a thing  and ive got this friend you see who makes me feel and i wanted more than i could steal ill arrest myself ill wear a shield ill go out of my way to make you a deal well make a pact to learn from who ever we want without new rules and well share whats lost and what we grew theyll go out of their way to prove they  still smell her on you they still smell her on you you might also like smell her on you,https://images.genius.com/d5f11d1fb2e0c8d803744da555a2b6ae.1000x1000x1.jpg,male,rock
112,Nirvana,Where Did You Sleep Last Night?,Where Did You Sleep Last Night? by Nirvana,1994-11-01,1994,11,1.0,536948,https://genius.com/Nirvana-where-did-you-sleep-last-night-lyrics,0,2,1, fuck you all this is the last song of the evening what is it this was written by what my favorite performer our favorite perfomer isnt it all of ours you like him the best oh and heres a donation basket for one supply of leadbellys guitar oh yeah this guy representing the leadbellys estate wants to sell me leadbellys guitar for 500000 passing a basket yeah i even asked david geffen personally if hed buy it for me he wouldnt do it  my girl my girl dont lie to me tell me where did you sleep last night in the pines in the pines where the sun dont ever shine i would shiver the whole night through  my girl my girl where will you go im going where the cold wind blows in the pines in the pines where the sun dont ever shine i would shiver the whole night through  her husband was a hard working man just about a mile from here his head was found in a driving wheel but his body never was found you might also like my girl my girl dont lie to me tell me where did you sleep last night in the pines in the pines where the sun dont ever shine i would shiver the whole night through shiver for me  my girl my girl where will you go im going where the cold wind blows in the pines in the pines where the sun dont ever shine i would shiver the whole night through  my girl my girl dont lie to me tell me where did you sleep last night in the pines in the pines where the sun dont ever shine i would shiver the whole night through  my girl my girl where will you go im going where the cold wind blows in the pines the pines the sun dont shine id shiver the whole night through  thank you,https://images.genius.com/d5f11d1fb2e0c8d803744da555a2b6ae.1000x1000x1.jpg,male,rock
113,Nirvana,Territorial Pissings,Territorial Pissings by Nirvana,1991-09-24,1991,9,24.0,532607,https://genius.com/Nirvana-territorial-pissings-lyrics,0,1,2, come on people now smile on your brother everybody get together try to love one another right now  when i was an alien cultures werent opinions  gotta find a way find a way when im there gotta find a way a better way id better wait  never met a wise man if so its a woman  gotta find a way find a way when im there gotta find a way a better way id better wait gotta find a way find a way when im there gotta find a way a better way id better wait  just because youre paranoid dont mean theyre not after you you might also like gotta find a way find a way when im there gotta find a way a better way id better wait gotta find a way find a way when im there gotta find a way a better way id better wait gotta find a way find a way when im there gotta find a way a better way id better wait gotta find a way find a way when im there gotta find a way ah ah yeah,https://images.genius.com/d5f11d1fb2e0c8d803744da555a2b6ae.1000x1000x1.jpg,male,rock
114,Nirvana,About a Girl,About a Girl by Nirvana,1989-06-15,1989,6,15.0,447322,https://genius.com/Nirvana-about-a-girl-lyrics,0,1,1,  i need an easy friend i do with an ear to lend i do think you fit this shoe i do but you have a clue  ill take advantage while you hang me out to dry but i cant see you every night free i do  i do im standin in your line i do hope you have the time i do pick a number too i do keep a date with you  ill take advantage while you hang me out to dry but i cant see you every night free you might also like  i do i need an easy friend i do with an ear to lend i do think you fit this shoe i do but you have a clue  ill take advantage while you hang me out to dry but i cant see you every night no i cant see you every night free  i do i do i do i do,https://images.genius.com/d5f11d1fb2e0c8d803744da555a2b6ae.1000x1000x1.jpg,male,rock
