,Artist,Song Title,Full Title,Release Date,Year,Month,Day,Pageviews,url,featured_count,producer_count,writer_count,Song Lyrics,Artist Image
0,2Pac,Hit ’Em Up,Hit 'Em Up by 2Pac (Ft. Outlawz),1996-06-04,1996,6,4,4283164,https://genius.com/2pac-hit-em-up-lyrics,1,1,8,"460 ContributorsTranslationsFrançaisAzərbaycanca / آذربايجانPortuguêsTürkçeHit ’Em Up Lyrics
(Sucka-ass)
I ain't got no mothafuckin' friends
That's why I fucked yo' bitch, you fat mothafucka!
(Take money) Westside, Bad Boy killas
(Take money) (You know) You know who the realest is
(Take money) Niggas, we bring it too
That's a'ight, haha
(Take money) Haha
First off, fuck yo' bitch and the clique you claim
Westside when we ride, come equipped with game
You claim to be a player, but I fucked your wife
We bust on Bad Boys, niggas fucked for life
Plus, Puffy tryna see me, weak hearts I rip
Biggie Smalls and Junior M.A.F.I.A., some mark-ass bitches
We keep on comin' while we runnin' for your jewels
Steady gunnin', keep on bustin' at them fools, you know the rules
Lil' Caesar, go ask your homie how I'll leave ya
Cut your young-ass up, leave you in pieces, now be deceased
Lil' Kim, don't fuck around with real G's
Quick to snatch yo' ugly ass off the streets, so fuck peace!
I'll let them niggas know it's on for life
Don't let the Westside ride tonight (Hahaha)
Bad Boy murdered on wax and killed
Fuck with me and get yo' caps peeled, you know
You might also like
See, grab your Glocks when you see 2Pac
Call the cops when you see 2Pac, uh
Who shot me? But you punks didn't finish
Now you 'bout to feel the wrath of a menace
Nigga, I hit 'em up! (Yeah)

Check this out (Take money)
You motherfuckers know what time it is
I don't even know why I'm on this track (Take money)
Y'all niggas ain't even on my level
I'ma let my lil' homies ride on you bitch-made ass (Take money)
Bad Ay ay ayo hold the fuck up
Boy bitches, feel it! (Take money)
Get out the way yo, get out the way yo
Biggie Smalls just got dropped
Little Mu', pass the MAC and let me hit him in his back
Frank White needs to get spanked right for settin' traps
Little accident murderer, and I ain't never heard of ya
Poisonous gats attack when I'm servin' ya
Spank ya, shank ya whole style when I gank
Guard your rank 'cause I'ma slam your ass in the paint
Puffy weaker than the fuckin' block I'm runnin' through, nigga
And I'm smokin' Junior M.A.F.I.A. in front of you, nigga
With the ready power tucked in my Guess under my Eddie Bauer
Your clout petty/sour, I push packages every hour; I hit 'em up!
Grab your Glocks when you see 2Pac
Call the cops when you see 2Pac, uh
Who shot me? But you punks didn't finish
Now you 'bout to feel the wrath of a menace
Nigga, we hit 'em up!

Peep how we do it, keep it real as penitentiary steel
This ain't no freestyle battle
All you niggas gettin' killed with your mouths open
Tryna come up off of me, you in the clouds hopin'
Smokin' dope, it's like a sherm high
Niggas think they learned to fly
But they burn, mothafucka, you deserve to die
Talkin' about you gettin' money, but it's funny to me
All you niggas livin' bummy while you fuckin' with me
I'm a self-made millionaire
Thug livin', out of prison, pistols in the air (Haha)
Biggie, remember when I used to let you sleep on the couch
And beg a bitch to let you sleep in the house?
Now it's all about Versace, you copied my style
Five shots couldn't drop me, I took it and smiled
Now I'm back to set the record straight
With my AK, I'm still the thug that you love to hate
Mothafucka, I hit 'em up!
I'm from N-E-W Jers' where plenty of murders occurs
No points or commas, we bring the drama to all you herbs
Now go check the scenario: Little Cease
I'll bring you fake G's to your knees, coppin' pleas in de Janeiro
Little Kim, is you coked up or doped up?
Get your little Junior Whopper click smoked up
What the fuck, is you stupid?
I take money, crash and mash through Brooklyn
With my click lootin', shootin' and pollutin' your block
With a 15-shot cocked Glock to your knot
Outlaw MAFIA clique movin' up another notch
And your pop stars popped and get mopped and dropped
All your fake-ass East Coast props brainstormed and locked

You's a beat biter, a Pac style taker
I'll tell you to your face, you ain't shit but a faker
Softer than Alizé with a chaser
'Bout to get murdered for the paper
E.D.I. Mean approach the scene of the caper
Like a loc, with Lil' Caesar in a choke
Gun totin' smoke, we ain't no motherfuckin' joke
Thug Life, niggas better be knowin'
We approachin' in the wide open, gun smokin'
No need for hopin', it's a battle lost
I got 'em crossed as soon as the funk is boppin' off
Nigga, I hit 'em up!

Now you tell me who won
I see them, they run, hahahaha
They don't wanna see us (Take money)
Whole Junior M.A.F.I.A. clique dressin' up tryna be us (Take money)
How the fuck they gonna be the mob
When we always on our job? (Take money)
We millionaires
Killin' ain't fair, but somebody gotta do it (Take money)
Oh yeah, Mobb Deep, huh, you wanna fuck with us? (Take money)
You little young-ass mothafuckas (Take money)
Don't one of you niggas got sickle-cell or somethin'? (Take money)
You're fuckin' with me, nigga
You fuck around and have a seizure or a heart attack (Take money)
You better back the fuck up
Before you get smacked the fuck up
This is how we do it on our side
Any of you niggas from New York that wanna bring it, bring it!
But we ain't singin', we bringin' drama
Fuck you and yo' motherfuckin' mama!
We gon' kill all you motherfuckers!
Now, when I came out, I told you it was just about Biggie
Then everybody had to open their mouth with a motherfuckin' opinion
Well, this is how we gonna do this: Fuck Mobb Deep! Fuck Biggie!
Fuck Bad Boy as a staff, record label, and as a motherfuckin' crew!
And if you wanna be down with Bad Boy, then fuck you too!
Chino XL, fuck you too!
All you motherfuckers, fuck you too!
(Take money, take money)
All of y'all motherfuckers, fuck you, die slow!
Motherfucker, my .44 make sho' all y'all kids don't grow!
You motherfuckers can't be us or see us
We motherfuckin' Thug Life ridas
Westside 'til we die!
Out here in California, nigga, we warned ya
We'll bomb on you motherfuckers! We do our job!
You think you mob? Nigga, we the motherfuckin' mob!
Ain't nothin' but killas
And the real niggas, all you motherfuckers feel us
Our shit goes triple and 4-quadruple (Take money)
You niggas laugh 'cause our staff got guns under they motherfuckas belts
You know how it is: when we drop records, they felt
You niggas can't feel it, we the realest
Fuck 'em, we Bad Boy killas!463Embed",https://images.genius.com/46cb64bfbd6e4b6e247a18dc54eab81d.788x788x1.jpg
1,2Pac,Changes,Changes by 2Pac (Ft. Talent),1998-10-13,1998,10,13,2079524,https://genius.com/2pac-changes-lyrics,1,1,3,"323 ContributorsTranslationsالعربيةChanges Lyrics
Ooh, yeah (Ooh)
(Come on, come on)

I see no changes, wake up in the morning and I ask myself
Is life worth livin'? Should I blast myself?
I'm tired of bein' poor and, even worse, I'm black
My stomach hurts so I'm lookin' for a purse to snatch
Cops give a damn about a negro
Pull the trigger, kill a nigga, he's a hero
""Give the crack to the kids, who the hell cares?
One less hungry mouth on the welfare""
First ship 'em dope and let 'em deal to brothers
Give 'em guns, step back, watch 'em kill each other
""It's time to fight back,"" that's what Huey said
Two shots in the dark, now Huey's dead
I got love for my brother
But we can never go nowhere unless we share with each other
We gotta start makin' changes
Learn to see me as a brother instead of two distant strangers
And that's how it's supposed to be
How can the Devil take a brother if he's close to me? Uh
I'd love to go back to when we played as kids
But things change, and that's the way it is
You might also like
(Come on, come on)
That's just the way it is (Changes)
Things'll never be the same
That's just the way it is (That's the way it is, what?)
Aww, yeah-yeah (Hear me)
(Oh my, oh my, come on, come on)
That's just the way it is (That's just the way it is, the way it is)
Things'll never be the same
(Never be the same, yeah, yeah, yeah, aww, yeah)
That's just the way it is (Way it is)
Aww, yeah (Come on, come on)
I see no changes, all I see is racist faces
Misplaced hate makes disgrace to races
We under, I wonder what it takes to make this
One better place, let's erase the wasted
Take the evil out the people, they'll be actin' right
'Cause both black and white are smokin' crack tonight
And the only time we chill is when we kill each other (Kill each other)
It takes skill to be real, time to heal each other
And although it seems heaven-sent
We ain't ready to see a black president, uh (Oh-ooh)
It ain't a secret, don't conceal the fact
The penitentiary's packed and it's filled with blacks
But some things will never change (Never change)
Try to show another way, but you stayin' in the dope game (Ooh)
Now tell me, what's a mother to do?
Bein' real don't appeal to the brother in you (Yeah)
You gotta operate the easy way
""I made a G today,"" but you made it in a sleazy way
Sellin' crack to the kids (Oh-oh), ""I gotta get paid"" (Oh)
Well hey, well that's the way it is
(Come on, come on)
That's just the way it is (Changes)
Things'll never be the same
That's just the way it is (That's the way it is, what?)
Aww, yeah (Hear me)
(Oh my, oh my, come on, come on)
That's just the way it is (That's just the way it is, the way it is)
Things'll never be the same
(Never be the same, yeah, yeah, yeah, aww, yeah)
That's just the way it is (Way it is)
Aww, yeah (Aww, yeah, aww, yeah)

We gotta make a change
It's time for us as a people to start makin' some changes
Let's change the way we eat
Let's change the way we live
And let's change the way we treat each other
You see, the old way wasn't workin'
So it's on us to do what we gotta do to survive

And still I see no changes, can't a brother get a little peace?
It's war on the streets and the war in the Middle East (Ooh, yeah)
Instead of war on poverty
They got a war on drugs so the police can bother me
And I ain't never did a crime I ain't have to do
But now I'm back with the facts, givin' it back to you (Ooh)
Don't let 'em jack you up, back you up
Crack you up and pimp-smack you up
You gotta learn to hold your own
They get jealous when they see you with your mobile phone
But tell the cops they can't touch this
I don't trust this, when they try to rush, I bust this
That's the sound of my tool, you say it ain't cool
My mama didn't raise no fool (Oh)
And as long as I stay black, I gotta stay strapped
And I never get to lay back
'Cause I always got to worry 'bout the payback
Some buck that I roughed up way back
Comin' back after all these years
""Rat-a-tat-tat-tat-tat,"" that's the way it is
(Uh)
That's just the way it is (Just the way it is, yeah, yeah, yeah)
Things'll never be the same (Yeah)
That's just the way it is (The way it is)
Aww, yeah (Some things will never change, oh my)
(I'm tryna make a change)
(You're my brother, you're my sister, yeah)
That's just the way it is (The way it is, the way it is)
Things'll never be the same (You're my brother, you're my sister)
That's just the way it is, aww, yeah
Some things'll never change345Embed",https://images.genius.com/46cb64bfbd6e4b6e247a18dc54eab81d.788x788x1.jpg
2,2Pac,Keep Ya Head Up,Keep Ya Head Up by 2Pac,1993-10-28,1993,10,28,1921875,https://genius.com/2pac-keep-ya-head-up-lyrics,0,1,4,"257 ContributorsKeep Ya Head Up Lyrics
Little something for my godson Elijah
And a little girl named Corin
Some say the blacker the berry, the sweeter the juice
I say the darker the flesh, then the deeper the roots (Oh)
I give a holla to my sisters on welfare
2Pac cares if don't nobody else care (Oh)
And, uh, I know they like to beat you down a lot
When you come around the block, brothers clown a lot
But please don't cry, dry your eyes, never let up
Forgive, but don't forget, girl, keep ya head up
And when he tells you you ain't nothin', don't believe him
And if he can't learn to love you, you should leave him
'Cause, sister, you don't need him
And I ain't tryin' to gas you up, I just call 'em how I see 'em (You don't need him)
You know what makes me unhappy? (What's that?)
When brothers make babies
And leave a young mother to be a pappy (Oh, yeah, yeah, yeah)
And since we all came from a woman
Got our name from a woman and our game from a woman (Yeah, yeah)
I wonder why we take from our women
Why we rape our women, do we hate our women?
(Why? Why? Why? Why? Why? Why?)
I think it's time to kill for our women
Time to heal our women, be real to our women
And if we don't, we'll have a race of babies
That will hate the ladies that make the babies (Oh, yeah-yeah)
And since a man can't make one
He has no right to tell a woman when and where to create one
So will the real men get up?
I know you're fed up, ladies, but keep ya head up
You might also like
(Keep ya head up)
Ooh, child, things are gonna get easier
(Keep-keep ya head up)
Ooh, child, things'll get brighter
(Oh-oh, keep ya head up)
Ooh, child, things are gonna get easier
(Keep-keep ya head up)
Ooh, child, things'll get brighter

Ayo, I remember Marvin Gaye used to sing to me
He had me feelin' like black was the thing to be
And suddenly the ghetto didn't seem so tough
And though we had it rough, we always had enough
I huffed and puffed about my curfew and broke the rules
Ran with the local crew and had a smoke or two
I realize Mama really paid the price
She nearly gave her life to raise me right (Oh, yeah-yeah)
And all I had to give her was my pipe dream
Of how I'd rock the mic and make it to the bright screen
I'm tryin' to make a dollar out of fifteen cents
It's hard to be legit and still pay your rent
And in the end, it seems I'm headin' for the pen'
I try to find my friends, but they're blowin' in the wind
Last night, my buddy lost his whole family
It's gonna take the man in me to conquer this insanity (Oh, no, no, no)
It seems the rain'll never let up
I try to keep my head up and still keep from gettin' wet up, huh
You know, it's funny, when it rains it pours
They got money for wars, but can't feed the poor
Said it ain't no hope for the youth
And the truth is it ain't no hope for the future
And then they wonder why we crazy, huh
I blame my mother for turnin' my brother into a crack baby
We ain't meant to survive 'cause it's a set-up
And even though you're fed up, huh, you got to keep ya head up
(Keep ya head up)
Ooh, child, things are gonna get easier
(Keep-keep ya head up)
Ooh, child, things'll get brighter
(Oh-oh, keep ya head up)
Ooh, child, things are gonna get easier
(Keep-keep ya head up)
Ooh, child, things'll get brighter

And, uh, to all the ladies havin' babies on they own
I know it's kinda rough and you're feelin' all alone
Daddy's long gone and he left you by your lonesome
Thank the Lord for my kids even if nobody else want 'em
'Cause I think we can make it, in fact, I'm sure
And if you fall, stand tall and come back for more (Oh-oh)
'Cause ain't nothin' worse than when your son
Wants to know why his daddy don't love him no mo'
You can't complain, you was dealt this hell of a hand
Without a man, feelin' helpless (I know you were)
Because there's too many things for you to deal with
Dyin' inside, but outside you're lookin' fearless
While the tears is rollin' down your cheeks
You're steady hopin' things don't all fall this week (Yeah)
'Cause if it did, you couldn't take it (Yeah)
And don't blame me, I was given this world, I didn't make it (Oh, yeah)
And now my son's gettin' older and older
And cold from havin' the world on his shoulders
While the rich kids is drivin' Benz
I'm still tryin' to hold on to survivin' friends (Oh, yeah)
And it's crazy, it seems it'll never let up
But, huh, please, you got to keep your head up206Embed",https://images.genius.com/46cb64bfbd6e4b6e247a18dc54eab81d.788x788x1.jpg
3,2Pac,Hail Mary,Hail Mary by 2Pac (Ft. Outlawz & Prince Ital Joe),1996-11-05,1996,11,5,1814737,https://genius.com/2pac-hail-mary-lyrics,2,1,7,"294 ContributorsTranslationsEnglishAzərbaycanca / آذربايجانHail Mary Lyrics

Makaveli in this, Killuminati
All through your body
The blow is like a 12-Gauge shotty
Uh, feel me!
(Come with me; Hail Mary, nigga, run quick, see)
And God said he should send his one begotten son
(What do we have here now? Do you wanna ride or die?)
To lead the wild into the ways of the man
Follow me! (La, la-da-la-la-la-la-la)
Eat my flesh, flesh of my flesh!

Come with me!
Hail Mary, nigga, run quick, see
What do we have here now?
Do you wanna ride or die?
La, la-da-la-la-la-la-la

I ain't a killer, but don't push me
Revenge is like the sweetest joy next to gettin' pussy
Picture paragraphs unloaded, wise words bein' quoted
Peeped the weakness in the rap game and sewed it
Bow down, pray to God, hopin' that he's listenin'
Seein' niggas comin' for me through my diamonds when they glistenin'
Now pay attention: bless me please, Father, I'm a ghost
In these killing fields, Hail Mary, catch me if I go
Let's go deep inside the solitary mind of a madman
Screams in the dark, evil lurks, enemies see me flee
Activate my hate, let it break to the flame
Set trip, empty out my clip, never stop to aim
Some say the game is all corrupt and fucked in this shit
Stuck, niggas is lucky if we bust out this shit
Plus, Mama told me never stop until I bust a nut
Fuck the world if they can't adjust, it's just as well, Hail Mary
You might also like
Come with me!
Hail Mary, nigga, run quick, see
What do we have here now?
Do you wanna ride or die?
La, da-da, da, da, da-da, da
Come with me!
Hail Mary, nigga, run quick, see
What do we have here now?
Do you wanna ride or die?
La, da-da, da, da, da-da, da

Penitentiaries is packed with promise-makers
Never realized the precious time that bitch niggas is wastin'
Institutionalized, I live my life a product made to crumble
Much too hardened for a smile, way too crazy to be humble
We ballin', catch me, Father, please
‘Cause I'm fallin' in the liquor store
Pass the Hennessy, I hear you callin', can I get some more?
Bail 'til I reach Hell, I ain't scared
Mama checkin' in my bedroom, I ain't there
I got a head with no screws in it, what can I do?
One life to live, but I got nothin' to lose
Just me and you on a one-way trip to prison, sellin' drugs
We all wrapped up in this livin', life as thugs
To my homeboys in Clinton Max doin' their bid
Raise hell to this real shit and feel this
When they turn out the lights, I'll be there in the dark
Thuggin' eternal through my heart
Now hail Mary, nigga!
Come with me!
Hail Mary, nigga, run quick, see
What do we have here now?
Do you wanna ride or die?
La, da-da, da, da, da-da, da
Come with me!
Hail Mary, nigga, run quick, see
What do we have here now?
Do you wanna ride or die?
La, da-da, da, da, da-da, da

They got a A-P-B out on my thug family
Since Outlawz run these streets like these scandalous freaks
Our enemies die now, walk around half-dead
Head down, K-blasted off of Hennessy and Thai Chronic
Mixed in, now I'm twisted, blistered and high
Visions of me thug-livin' gettin' me by
Forever live, and I multiply, survived by thugs
When I die they won't cry unless they comin' with slugs

Peep the whole scene and whatever's goin' on around me
Brain kind of cloudy, smoked out, feelin' rowdy
Ready to wet the party up
And whoever in that motherfucker, nasty new street slugger
My heat seeks suckers on the regular
Mashin' in a stolen Black Ac' Integra
Cocked back, sixty seconds 'til the draw, that's when I'm deadin' ya
Feet first, you've got a nice Gat but my heat's worse
From a thug to preachin' church
I gave you love, now you eatin' dirt
Needin' work, and I ain't the nigga to put you on
‘Cause word is bond
When I was broke, I had to hustle 'til dawn
That's when the sun came up, there's only one way up
Hold your head and stay up
To all my niggas, get your pay and weight up
If it's on, then it's on, we rape beat-breaks
Outlawz on a paper chase, can you relate?
To this shit I don't got be the shit I gotta take
Dealin' with fate, hopin' God don't close the gate
If it's on, then it's on, we rape beat-breaks
Outlawz on a paper chase, can you relate?
To this shit I don't got be the shit I gotta take
Dealin' with fate, hopin' God don't close the gate

Come with me!
Hail Mary, nigga, run quick, see
What do we have here now?
Do you wanna ride or die?
We've been travelin' on this weary road
Sometimes life can be a heavy load
But we ride, ride it like a bullet
Hail Mary, hail Mary (Hail Mary)
We won't worry, everything will curry
Free like the bird in the tree
We won't worry, everything will curry
Yes, we free like the bird in the tree
We runnin' from the penitentiary
This is the time for we liberty
Hail Mary, hail Mary!

Westside, Outlawz
Makaveli the Don, solo
Killuminati, The 7 Days191Embed",https://images.genius.com/46cb64bfbd6e4b6e247a18dc54eab81d.788x788x1.jpg
4,2Pac,Dear Mama,Dear Mama by 2Pac,1995-02-21,1995,2,21,1743476,https://genius.com/2pac-dear-mama-lyrics,0,1,6,"217 ContributorsTranslationsPortuguêsDeutschEnglish2Pac - Dear Mama (الترجمة العربية)Dear Mama Lyrics
You are appreciated

When I was young, me and my mama had beef
Seventeen years old, kicked out on the streets
Though back at the time I never thought I'd see her face
Ain't a woman alive that could take my mama's place
Suspended from school, and scared to go home
I was a fool, with the big boys breakin' all the rules
I shed tears with my baby sister, over the years
We was poorer than the other little kids
And even though we had different daddies, the same drama
When things went wrong we'd blame Mama
I reminisce on the stress I caused, it was hell
Huggin' on my mama from a jail cell
And who'd think in elementary, hey
I'd see the penitentiary one day?
And runnin' from the police, that's right
Mama catch me, put a whoopin' to my backside
And even as a crack fiend, Mama
You always was a black queen, Mama
I finally understand
For a woman, it ain't easy tryin' to raise a man
You always was committed
A poor single mother on welfare, tell me how you did it
There's no way I can pay you back
But the plan is to show you that I understand
You are appreciated
You might also like
Lady, don't you know we love ya? (Dear Mama)
Sweet lady, place no one above ya (You are appreciated)
Sweet lady, don't you know we love ya?

Now, ain't nobody tell us it was fair
No love for my daddy, 'cause the coward wasn't there
He passed away and I didn't cry
'Cause my anger wouldn't let me feel for a stranger
They say I'm wrong and I'm heartless, but all along
I was lookin' for a father, he was gone
I hung around with the thugs, and even though they sold drugs
They showed a young brother love
I moved out and started really hangin'
I needed money of my own, so I started slangin'
I ain't guilty, 'cause even though I sell rocks
It feels good puttin' money in your mailbox
I love payin' rent when the rent is due
I hope you got the diamond necklace that I sent to you
'Cause when I was low you was there for me
You never left me alone, because you cared for me
And I could see you comin' home after work late
You're in the kitchen, tryin' to fix us a hotplate
You just workin' with the scraps you was given
And Mama made miracles every Thanksgivin'
But now the road got rough, you're alone
You're tryin' to raise two bad kids on your own
And there's no way I can pay you back
But my plan is to show you that I understand
You are appreciated
Lady, don't you know we love ya? (Dear Mama)
Sweet lady, place no one above ya (You are appreciated)
Sweet lady, don't you know we love ya?

Pour out some liquor and I reminisce
'Cause through the drama, I can always depend on my mama
And when it seems that I'm hopeless
You say the words that can get me back in focus
When I was sick as a little kid
To keep me happy there's no limit to the things you did
And all my childhood memories
Are full of all the sweet things you did for me
And even though I act crazy
I gotta thank the Lord that you made me
There are no words that can express how I feel
You never kept a secret, always stayed real
And I appreciate how you raised me
And all the extra love that you gave me
I wish I could take the pain away
If you can make it through the night, there's a brighter day
Everything will be alright if you hold on
It's a struggle every day, gotta roll on
And there's no way I can pay you back
But my plan is to show you that I understand
You are appreciated
Lady, don't you know we love ya? (Dear Mama)
Sweet lady, place no one above ya (You are appreciated)
Sweet lady, don't you know we love ya? (Dear Mama)
Sweet lady, lady (Dear Mama)
Lady, lady255Embed",https://images.genius.com/46cb64bfbd6e4b6e247a18dc54eab81d.788x788x1.jpg
