,Artist,Song Title,Full Title,Release Date,Year,Month,Day,Pageviews,url,featured_count,producer_count,writer_count,Song Lyrics,Artist Image
97,JAY-Z,Song Cry,Song Cry by JAY-Z,2002-05-08,2002,5,8,825399,https://genius.com/Jay-z-song-cry-lyrics,0,1,2,"102 ContributorsSong Cry Lyrics
Picture all the possibilities
Picture all the possibilities
Sounds like a love song
Sounds like a love song
The most incredible, baby
Uh
Mmm, mmm, mmm, mmm
Yeah, yeah
Uh
I can't see 'em comin' down my eyes
So I gotta make the song cry
I can't see 'em comin' down my eyes
So I gotta make the song cry

Good dude, I know you love me like cooked food
Even though a nigga gotta move like a crook move
We was together on the block since free lunch
We shoulda been together havin' Four Seasons brunch
We used to use umbrellas to face the bad weather
So now we travel first-class to change the forecast
Never in bunches, just me and you
I loved your point of view 'cause you held no punches
Still I left you for months on end
It's been months since I checked back in
We're somewhere in a small town
Somewhere lockin' a mall down
Woodgrain, four and change, Armor All'd down
I can understand why you want a divorce now
Though I can't let you know it, pride won't let me show it
Pretend to be heroic, that's just one to grow with
But deep inside, a nigga so sick
You might also like
I can't see 'em comin' down my eyes
So I gotta make the song cry
I can't see 'em comin' down my eyes
So I gotta let the song cry, uh
Can't see it comin' down my eyes
So I gotta make the song cry
I can't see it comin' down my eyes
So I got to make the song cry

On repeat, the CD of Big's ""Me & My Bitch""
Watchin' Bonnie and Clyde, pretendin' to be that shit
Empty gun in your hand, sayin', ""Let me see that clip""
Shopping sprees, pull out your Visa quick
A nigga had very bad credit, you helped me lease that whip
You helped me get the keys to that V dot 6
We was so happy poor, but when we got rich
That's when our signals got crossed and we got flipped
Rather mine, I don't know what made me leave that shit
Made me speed that quick, let me see, that's it
It was the cheese, helped them bitches get amnesia quick
I used to cut up they buddies, now they sayin' they love me
Used to tell they friends I was ugly and wouldn't touch me
Then I showed up in that dubbed-out buggy
And then they got fuzzy, and they don't remember that
And I don't remember you
I can't see it comin' down my eyes
So I gotta make the song cry
I can't see it comin' down my eyes
So I gotta make the song cry
Yeah, I seen 'em comin' down your eyes
But I gotta make the song cry
I can't see it comin' down my eyes
So I gotta make the song cry

A face of stone, was shocked on the other end of the phone
Word back home is that you had a special friend
So what was oh so special then?
You have given away without gettin' at me
That's your fault, how many times you forgiven me?
How was I to know that you was plain sick of me?
I know the way a nigga livin' was wack
But you don't get a nigga back like that
Shit, I'm a man with pride, you don't do shit like that
You don't just pick up and leave and leave me sick like that
You don't throw away what we had just like that
I was just fuckin' them girls, I was gon' get right back
They say you can't turn a bad girl good
But once a good girl's gone bad, she's gone forever
I'll mourn forever
Shit, I've got to live with the fact I did you wrong forever
I can't see 'em comin' down my eyes
So I gotta make the song cry
I can't see 'em comin' down my eyes
So I gotta let the song cry
I know, I seen 'em comin' down your eyes
But I gotta make the song cry
I can't see 'em comin' down my eyes
So I gotta make the song cry

It's fucked up, girl42Embed",https://images.genius.com/dab4680bbb0569024ef3df3d1e87c277.570x570x1.jpg
98,JAY-Z,Smile,Smile by JAY-Z (Ft. Gloria Carter),2017-06-30,2017,6,30,806606,https://genius.com/Jay-z-smile-lyrics,1,2,3,"254 ContributorsTranslationsTürkçePortuguêsEnglishEspañolSmile Lyrics
Good morn' or evening, friends
Smile, you recordin'?

Slammin' Bentley doors like we invented doors
20 years ago we drove Bentley Azures
We drinkin' Cristal then
Yeah, kept the tray on me like Chris Paul then
Drinkin' Ace of Spades like it's codeine now
Tryna put a million on the whole team now
Push through the pain so we can see new life
So all the ladies havin' babies, see ya sacrifice
Mama had four kids, but she's a lesbian
Had to pretend so long that she's a thespian
Had to hide in the closet, so she medicate
Society shame and the pain was too much to take
Cried tears of joy when you fell in love
Don't matter to me if it's a him or her
I just wanna see you smile through all the hate
Marie Antoinette, baby, let 'em eat cake

Bad times turn to good memories, smile
Even when I'm gone and you remember me, smile
Good times never fade away, smile
Even if I'm not with you here today, smile
Good morn' or evening, friends
Smile
Here's your friendly announcer
Smile
You might also like
Far as draft picks, my name did not get called
Bet before I go I put a billion on the board
Hall of Fame Hov, I did it all without a pen
Y'all knew that was comin', I had to remind y'all again, huh?
Flyin' paper planes through the projects
Now the whole projects on my jet
Now you see the real in the front row
In every one of y'all televised shows
Super facts
Niggas switched sides, traded pride, we don't do all that
A loss ain't a loss, it's a lesson
Appreciate the pain, it’s a blessin'

Bad times turn to good memories, smile
Even when I'm gone and you remember me, smile
Good times never fade away, smile
Even if I'm not with you here today, smile
Good morn' or evening, friends
I mastered my aesthetics
I know you often heard me wax poetic
'Bout bein' back in the Lexus
But trust me, that was nothin', a nigga up in
The hundreds of millions, I have no ceilings
Ah, this that feelin', I'm that boy
Anita Baker's ""You Bring Me Joy"" slappin' out of the toy
The separation is clear in my rear-view mirror
Objects is further than they appear
Oh yeah, I was born with a pair, playin' for high stakes
Norman's Cay, he looked up and out of the Lear
How niggas can't relate?
Fuck a slice of the apple pie, want my own cake
In charge of my own fate, respect Jimmy Iovine
But he gotta respect the Elohim as a whole new regime
And niggas playin' for power, huh
So our music is ours, niggas own their own houses
Ours was, ""Fuck you, pay me""
Now it's, ""Fuck payin' me, I pay you
Put the rest away for Blue""
That blood money I giggle at it
Can't even support my miss' habit
Jewelry shoppin' in Pa- all ya jewelers should be embarrassed
Huh, blood diamonds drippin' with guilt, I still ain't trippin'
That's life, winners and losers
Drug dealers and abusers, America like me ruthless
My therapist said I relapsed
I said, ""Pre-haps I Freudian slipped in European whips""
God sent me to break the chain, I'm the true and livin'
God in the flesh, the rest of these niggas is vain
A stain on the white suit, inferior IQ
Niggas'll rip your shit off TIDAL just to spite you
Ahhhh, what did I do? 'Cept try to free you
Niggas'll love you but hate you 'cause they can't be you
Dump 'em all in the bayou, uh
Everybody wave bye to the guy you thought you could lie to
This was meant to be a haiku, huh
But my story's too wide to fit inside the line or two
Oh, these that drugs, heron flow, I spaz on the stove
This is Hov, no flex zone, nigga, who lied to you?
Look, you a pedestrian, don't ever question the security I provided you
Oh y'all thought I was washed? I'm at the cleaners
Launderin' dirty money like the Teamsters, huh
Shout out to Hoffa back home, he in the church
When I heard you got booked, that shit hurt
Feel for you bro, we know the system don't work
Take a young nigga freedom over some dirt
Yet it's legal in Colorado, yet, we deny
Black entrepreneurs, free enterprise
That's why it's a black market, that's why it's called the trap
That's why it's called the projects 'cause it's exactly that
All these people was gon' kill me, heh
'Cause the more I reveal me, the more they 'fraid of the real me
Welcome back Carter, smile
Living in the shadow
Can you imagine what kind of life it is to live?
In the shadows people see you as happy and free
Because that's what you want them to see
Living two lives, happy, but not free
You live in the shadows for fear of someone hurting your family or the person you love
The world is changing and they say it's time to be free
But you live with the fear of just being me
Living in the shadow feels like the safe place to be
No harm for them, no harm for me
But life is short, and it's time to be free
Love who you love, because life isn't guaranteed
Smile26Embed",https://images.genius.com/dab4680bbb0569024ef3df3d1e87c277.570x570x1.jpg
99,JAY-Z,Open Letter,Open Letter by JAY-Z,2013-04-11,2013,4,11,789134,https://genius.com/Jay-z-open-letter-lyrics,0,2,9,"141 ContributorsTranslationsFrançaisEnglishOpen Letter Lyrics
Ladies and gentlemen
Goddammit
Let this shit knock

I done turned Havana to Atlanta
Guayabera shirts and bandanas
Every time you think they got me I switch the planner
Bulletproof this, radio scanners
(You got scanners, we got scanners)
Balling 'til they ban us
You getting too much bread, they try to jam you
Boy from the hood but got White House clearance
Sorry y'all, I don't agree with y'all parents
Politicians never did shit for me
Except lie to me, distort history
Wanna give me jail time and a fine
Fine, let me commit a real crime
I might buy a kilo for Chief Keef
Out of spite, I just might flood these streets
Hear the freedom in my speech
Got an onion from Universal, read it and weep
Would've brought the Nets to Brooklyn for free
Except I made millions off it, you fuckin' dweeb
I still own the building, I'm still keeping my seat
Y'all buy that bullshit, you'd better keep y'all receipt
Obama said ""Chill, you gonna get me impeached""
But you don't need this shit anyway, chill with me on the beach
You might also like
Y'all gon' learn today

Uh, y'all must want to start a revolution
You know whenever I'm threatened, I start shooting (Bang!)
Catch a body, head to Houston
I'm in Cuba, I love Cubans
This communist talk is so confusing
When it's from China, the very mic that I'm using
Idiot wind, the Bob Dylan of rap music
You're an idiot, baby, you should become a student
Oh, you gonna learn today
Where the fuck have you been
The world's under new management
The new role model, fuck this Zoolander shit
Y'all gon' learn today30Embed",https://images.genius.com/dab4680bbb0569024ef3df3d1e87c277.570x570x1.jpg
100,Kanye West,Mercy,"Mercy by Kanye West (Ft. 2 Chainz, Big Sean & Pusha T)",2012-04-03,2012,4,3,7160679,https://genius.com/Kanye-west-mercy-lyrics,3,4,17,"492 ContributorsMercy Lyrics
Well, it is a weepin' and a moanin' and a gnashin' of teeth
It is a weepin' and a moanin' and a gnashin' of teeth
It is a—when it comes to my sound which is the champion sound
Believe, believe
O-o-o-o-o-okay, Lamborghini Mercy
Your chick, she so thirsty
I-I-I-I-I'm in that two-seat Lambo
With your girl, she tryna jerk me (Believe)
O-o-o-o-o-okay, Lamborghini Mercy
Your chick, she so thirsty
I-I-I-I-I'm in that two-seat Lambo
With your girl, she tryna jerk me
O-o-o-o-o-okay, Lamborghini Mercy (Swerve)
Your chick, she so thirsty (Swerve)
I-I-I-I-I'm in that two-seat Lambo
With your girl, she tryna jerk me (Woah, believe)
O-o-o-o-o-okay, Lamborghini Mercy
Your chick, she so thirsty (Boy)
I-I-I-I-I'm in that two-seat Lambo (Boy)
With your girl, she tryna jerk me

Okay, drop it to the floor, make that ass shake (Shake, shake)
Woah, make the ground move: that's an ass quake
Built a house up on that ass: that's an ass-state
Roll–roll–roll my weed on it: that's an ass tray
Say, Ye, say, Ye, don't we do this every day–day? (Huh?)
I work them long nights, long nights to get a payday (Huh?)
Finally got paid, now I need shade and a vacay
And niggas still hatin'
So much hate, I need a AK (AK)
Now we out in Paris, yeah, I'm Perrierin'
White girls politickin': that's that Sarah Palin
Get–get–get–get–get–gettin' hot, Californicatin'
I give her that D, 'cause that's where I was born and raised in
You might also like
O-o-o-o-o-okay, Lamborghini Mercy (Swerve)
Your chick, she so thirsty (Swerve)
I-I-I-I-I'm in that two-seat Lambo (Swerve)
With your girl, she tryna jerk me (Swerve, believe)
O-o-o-o-o-okay, Lamborghini Mercy (Swerve)
Your chick, she so thirsty (Swerve)
I-I-I-I-I'm in that two-seat Lambo (Swerve)
With your girl, she tryna jerk me (Swerve)
Well, it is a weepin' and a moanin' (Swerve)
And a gnashin' of teeth (Swerve)
It is a weepin' and a mournin' (Swerve)
And a gnashin' of teeth (Swerve)
It is a—when it comes to my sound (Swerve)
Which is the champion sound (Swerve)
Believe, believe (Swerve)
Believe, believe (Swerve)
Yuugh! It's prime time, my top back, this pimp game, ho
I'm red leather, this cocaine, I'm Rick James, ho
I'm bill-droppin', Ms. Pac-Man, this pill-poppin' ass ho
I'm poppin' too, these blue dolphins need two coffins
All she want is some heel money
All she need is some bill money
He take his time, he counts it out
I weighs it up, that's real money
Check the neck, check the wrist
Them heads turnin': that's exorcist
My Audemars like Mardi Gras
That's Swiss time, and that's excellence
Two-door preference
Roof gone, George Jefferson
That white frost on that pound cake
So your Duncan Hines is irrelevant, woo
Lambo Murciélago
She go wherever I go
Wherever we go, we do it pronto, it's like—
O-o-o-o-o-okay, Lamborghini Mercy (Swerve)
Your chick, she so thirsty (Swerve)
I-I-I-I-I'm in that two-seat Lambo (Swerve)
With your girl, she tryna jerk me (Swerve, believe)
O-o-o-o-o-okay, Lamborghini Mercy (Swerve)
Your chick, she so thirsty (Swerve)
I-I-I-I-I'm in that two-seat Lambo (Swerve)
With your girl, she tryna jerk me (Swerve)
Well, it is a weepin' and a moanin' (Swerve)
And a gnashin' of teeth (Swerve)
It is a weepin' and a mournin' (Swerve)
And a gnashin' of teeth (Swerve)
It is a—when it comes to my sound (Swerve)
Which is the champion sound (Swerve)
Believe, believe (Swerve)
Believe (Swerve)

Well, it is a weepin' and a moanin'
And a gnashin' of teeth in the dancehall
And who no have teeth gwan rub pon dem gums
Cuh when time it comes to my sound
Which is the champion sound
The bugle has blown fi many times
And it still have one more time left
Cuh the amount of stripe weh deh pon our shoulder
Let the suicide doors up
I threw suicides on the tour bus
I threw suicides on the private jet
You know what that mean, I'm fly to death
I step in Def Jam buildin' like I'm the shit
Tell 'em gimme fifty million or I'ma quit
Most rappers' taste level ain't at my waist level
Turn up the bass 'til it's up-in-yo-face level
Don't do no press but I get the most press, kid
Plus, yo, my bitch make your bitch look like Precious
Somethin' 'bout Mary, she gone off that molly
Now the whole party is melting like Dalí
Now everybody is movin' they body
Don't sell me apartment, I'll move in the lobby (Yah)
Niggas is loiterin' just to feel important
You gon' see lawyers and niggas in Jordans (2 Chainz)
Okay, now catch up to my campaign
Coupe the color of mayonnaise
I'm drunk and high at the same time
Drinkin' champagne on the airplane (Tell 'em)
Spit rounds like a gun range (Baow)
Beat it up like Rampage
Hundred bands, cut your girl
Now your girl need a Band-Aid (Damn)
Grade A, A1
Chain the color of Akon
Black diamonds, backpack rhymin'
Co-signed by Louis Vuitton (Yep)
Horsepower, horsepower
All this Polo on, I got horsepower
Pound of this cost four thousand
Now I make it rain, she want more showers
Rain (Rain) pourin' (Pourin')
All my cars is foreign (Foreign)
All my broads is foreign (Foreign)
Money tall like Jordan
O-o-o-o-o-okay, Lamborghini Mercy (Swerve)
Your chick, she so thirsty (Swerve)
I-I-I-I-I'm in that two-seat Lambo (Swerve)
With your girl, she tryna jerk me (Swerve)
O-o-o-o-o-okay, Lamborghini Mercy (Swerve)
Your chick, she so thirsty (Swerve)
I-I-I-I-I'm in that two-seat Lambo (Swerve, believe)
With your girl, she tryna jerk me (Swerve, believe)
Well, it is a weepin' and a moanin' (Swerve)
And a gnashin' of teeth (Swerve)
It is a weepin' and a moanin' (Swerve)
And a gnashin' of teeth (Swerve)
It is a—when it comes to my sound (Swerve)
Which is the champion sound (Swerve)
Believe, believe (Swerve)
Believe, believe (Swerve)
Well, it is a weepin' and a moanin' and a gnashin' of teeth
It is a weepin' and a moanin' and a gnashin' of teeth
It is a—when it comes to my sound which is the champion sound
Believe, believe, believe, believe373Embed",https://images.genius.com/6554f35f985155695946adea457197af.736x736x1.jpg
101,Kanye West,Monster,"Monster by Kanye West (Ft. Bon Iver, JAY-Z, Nicki Minaj & Rick Ross)",2010-08-27,2010,8,27,5088364,https://genius.com/Kanye-west-monster-lyrics,4,3,11,"513 ContributorsTranslationsPortuguêsEnglishSvenskaDanskMonster Lyrics
I shoot the lights out
Hide 'til it's bright out
Oh, just another lonely night
Are you willing to sacrifice your life?

Bitch, I'm a monster, no-good bloodsucker
Fat motherfucker, now look who's in trouble
As you run through my jungles, all you hear is rumbles
Kanye West samples, here's one for example

Gossip, gossip, nigga, just stop it
Everybody know I'm a motherfuckin' monster
I'ma need to see your fuckin' hands at the concert
I'ma need to see your fuckin' hands at the concert
Profit, profit, nigga, I got it
Everybody know I'm a motherfuckin' monster
I'ma need to see your fuckin' hands at the concert
I'ma need to see your fuckin' hands
Uh, the best living or dead hands down, huh
Less talk, more head right now, huh
And my eyes more red than the devil is
And I'm 'bout to take it to another level, bitch
Matter who you go and get, ain't nobody cold as this
Do the rap and the track, triple-double, no assists
And my only focus is stayin' on some bogus shit
Arguin' with my older bitch, actin' like I owe her shit
I heard the beat, the same raps that gave the track pain
Bought the chain that always give me back pain
Fucking up my money so, yeah, I had to act sane
Chi nigga, but these hoes love my accent
Chick came up to me and said, ""This the number to dial
If you wanna make your number one your number two now""
Mix that Goose and Malibu, I call it ""Malibooyah""
Goddamn, Yeezy always hit 'em with a new style
Know that motherfucker, well, what you gon' do now?
Whatever I wanna do, gosh, it's cool now
Know I'm gonna do, ah, it's the new now
Think you motherfuckers really really need to cool out
'Cause you'll never get on top of this
So, mami, best advice is just to get on top of this
Have you ever had sex with a pharaoh?
Ah, put the pussy in a sarcophagus
Now she claiming that I bruised her esophagus
Head of the class and she just won a swallowship
I'm livin' in the future so the present is my past
My presence is a present, kiss my ass
You might also like
Gossip, gossip, nigga, just stop it
Everybody know I'm a motherfuckin' monster
I'ma need to see your fuckin' hands at the concert
I'ma need to see your fuckin' hands at the concert (Yeah)
Profit, profit, nigga, I got it
Everybody know I'm a motherfuckin' monster
I'ma need to see your fuckin' hands at the concert
I'ma need to see your fuckin' hands
Sasquatch, Godzilla, King Kong, Loch Ness
Goblin, ghoul, a zombie with no conscience
Question, what do these things all have in common?
Everybody knows I'm a motherfuckin' monster
Conquer, stomp ya, stop your silly nonsense
Nonsense, none of you niggas know where the swamp is
None of you niggas have seen the carnage that I've seen
I still hear fiends scream in my dreams
Murder, murder in black convertibles, I
Kill a block, I murder the avenues, I
Rape and pillage your village, women and children
Everybody want to know what my Achilles heel is
Love, I don't get enough of it
All I get is these vampires and bloodsuckers
All I see is these niggas I made millionaires
Millin' about, spillin' they feelings in the air
All I see is these fake fucks with no fangs
Tryna draw blood from my ice-cold veins
I smell a massacre
Seems to be the only way to back you bastards up
Gossip, gossip, nigga, just stop it
Everybody know I'm a motherfuckin' monster
I'ma need to see your fuckin' hands at the concert
I'ma need to see your fuckin' hands at the concert
Profit, profit, nigga, I got it
Everybody know I'm a motherfuckin' monster
I'ma need to see your fuckin' hands at the concert
I'ma need to see your fuckin' hands
Pull up in the monster, automobile gangsta
With a bad bitch that came from Sri Lanka
Yeah, I'm in that Tonka, color of Willy Wonka
You could be the king, but watch the queen conquer
Okay, first things first, I'll eat your brains
Then I'ma start rocking gold teeth and fangs
'Cause that's what a motherfuckin' monster do
Hair dresser from Milan, that's the monster 'do
Monster Giuseppe heel, that's the monster shoe
Young Money is the roster and a monster crew
And I'm all up, all up, all up in the bank with the funny face
And if I'm fake, I ain't notice 'cause my money ain't
So let me get this straight, wait, I'm the rookie?
But my features and my shows ten times your pay?
50K for a verse, no album out
Yeah, my money's so tall that my Barbies got to climb it
Hotter than a Middle Eastern climate, violent
Tony Matterhorn, dutty wine it, wine it
Nicki on them titties when I sign it
That's how these niggas so one-track-minded
But really, really I don't give an F-U-C-K
""Forget Barbie, fuck Nicki, sh-she's fake""
""She on a diet,"" but my pockets eatin' cheesecake
And I'll say, bride of Chucky, it's child's play
Just killed another career, it's a mild day
Besides, Ye, they can't stand besides me
I think me, you, and Am' should ménage Friday
Pink wig, thick ass, give 'em whiplash
I think big, get cash, make 'em blink fast
Now look at what you just saw, this is what you live for
Ah, I'm a motherfuckin' monster
I, I crossed the limelight
And I'll, I'll let God decide
And I, I wouldn't last these shows
So I, I am headed home (Headed home)
I, I crossed the limelight
And I'll, I'll let God decide, 'cide (No)
And I, I wouldn't last these shows
So I, I am headed home (Head home)
I, I crossed the limelight (No, the limelight)
And I'll, I'll let God decide, 'cide
And I, I wouldn't last these shows
So I, I am headed home
413Embed",https://images.genius.com/6554f35f985155695946adea457197af.736x736x1.jpg
102,Kanye West,"Father Stretch My Hands, Pt. 1","Father Stretch My Hands, Pt. 1 by Kanye West (Ft. Kid Cudi)",2016-02-14,2016,2,14,5005200,https://genius.com/Kanye-west-father-stretch-my-hands-pt-1-lyrics,1,7,15,"328 ContributorsTranslationsEspañolPortuguêsPolskiItalianoFrançaisSvenskaTürkçeРусскийFather Stretch My Hands, Pt. 1 Lyrics
You're the only power (Power)
You're the only power that can
You're the only power (Power)
You're the only power that can
Oh, oh, oh, father
(If young Metro don't trust you, I'm gon' shoot you)

Beautiful mornin', you're the sun in my mornin', babe
Who can I turn to?
Nothin' unwanted
After all, who can I turn to?
Beautiful mornin', you're the sun in my mornin', babe
If I don't turn to you
Nothin' unwanted
No other help I know, I stretch my hands

I just wanna feel liberated, I-I, na-na-na
Who can I turn to?
I just wanna feel liberated, I-I, na-na-na
After all, who can I turn to?
If I ever instigated, I am sorry
If I don't turn to you
Tell me who in here could relate, I-I-I
No other help I know, I stretch my hands
You might also like
Now, if I fuck this model
And she just bleached her asshole
And I get bleach on my T-shirt
I'ma feel like an asshole
I was high when I met her
We was down in Tribeca
She'll get under your skin if you let her
She'll get under your skin if you— (Uh)
I don't even wanna talk about it
I don't even wanna talk about it
I don't even wanna say nothin'
Everybody gon' say somethin'
I'd be worried if they said nothin'
Remind me where I know you from
She lookin' like she owe you somethin'
You know just what we want
I wanna wake up with you in my—

Beautiful mornin', you're the sun in my mornin', babe
Who can I turn to?
Beautiful mornin'
Nothin' unwanted
After all, who can I turn to?
Beautiful mornin', you're the sun in my mornin', babe
If I don't turn to you
Nothin' unwanted
No other help I know
I just wanna feel liberated, I-I, na-na-na
Who can I turn to?
I just wanna feel liberated, I-I, na-na-na
After all, who can I turn to?
If I ever instigated, I am sorry
If I don't turn to you
Tell me who in here could relate, I-I-I
No other help I know, I stretch my hands292Embed",https://images.genius.com/6554f35f985155695946adea457197af.736x736x1.jpg
