,Artist,Song Title,Full Title,Release Date,Year,Month,Day,Pageviews,url,featured_count,producer_count,writer_count,Song Lyrics,Artist Image
44,Eminem,Without Me,Without Me by Eminem,2002-05-14,2002,5,14,5640754,https://genius.com/Eminem-without-me-lyrics,0,3,8,"459 ContributorsTranslationsTürkçeDeutschEspañolFrançais日本語हिन्दीWithout Me Lyrics
Obie Trice, real name, no gimmicks
Ra—, *record scratch*

Two trailer-park girls go round the outside
Round the outside, round the outside
Two trailer-park girls go round the outside
Round the outside, round the outside
Woo! (Ooh, ooh)

Guess who's back, back again?
Shady's back, tell a friend
Guess who's back? Guess who's back?
Guess who's back? Guess who's back?
Guess who's back? Guess who's back?
Guess who's back?
(Da-da-da, da, da, da, da, da, da)
(Da-da-da, da, da, da, da)

I've created a monster
'Cause nobody wants to see Marshall no more, they want Shady, I'm chopped liver
Well, if you want Shady, this is what I'll give ya
A little bit of weed mixed with some hard liquor
Some vodka that'll jump-start my heart quicker
Than a shock when I get shocked at the hospital
By the doctor when I'm not cooperating
When I'm rockin' the table while he's operating (Hey!)
You waited this long, now stop debating
'Cause I'm back, I'm on the rag and ovulating
I know that you got a job, Ms. Cheney
But your husband's heart problem's complicating
So the FCC won't let me be
Or let me be me, so let me see
They tried to shut me down on MTV
But it feels so empty without me
So come on and dip, bum on your lips
Fuck that, cum on your lips and some on your tits
And get ready, 'cause this shit's about to get heavy
I just settled all my lawsuits (Fuck you, Debbie!)
You might also like
Now, this looks like a job for me
So everybody, just follow me
'Cause we need a little controversy
'Cause it feels so empty without me
I said this looks like a job for me
So everybody, just follow me
'Cause we need a little controversy
'Cause it feels so empty without me

Little hellions, kids feeling rebellious
Embarrassed, their parents still listen to Elvis
They start feelin' like prisoners, helpless
'Til someone comes along on a mission and yells, ""Bitch!""
A visionary, vision is scary
Could start a revolution, pollutin' the airwaves
A rebel, so just let me revel and bask
In the fact that I got everyone kissin' my ass
And it's a disaster, such a catastrophe
For you to see so damn much of my ass, you asked for me?
Well, I'm back, da-na-na-na, na-na-na-na-na-na
Fix your bent antenna, tune it in, and then I'm gonna
Enter in and up under your skin like a splinter
The center of attention, back for the winter
I'm interesting, the best thing since wrestling
Infesting in your kid's ears and nesting
Testing, ""Attention, please""
Feel the tension soon as someone mentions me
Here's my ten cents, my two cents is free
A nuisance, who sent? You sent for me?
Now, this looks like a job for me
So everybody, just follow me
'Cause we need a little controversy
'Cause it feels so empty without me
I said this looks like a job for me
So everybody, just follow me
'Cause we need a little controversy
'Cause it feels so empty without me

A tisket, a tasket, I'll go tit-for-tat wit'
Anybody who's talkin', ""This shit, that shit""
Chris Kirkpatrick, you can get your ass kicked
Worse than them little Limp Bizkit bastards
And Moby? You can get stomped by Obie
You thirty-six-year-old bald-headed fag, blow me
You don't know me, you're too old, let go
It's over, nobody listens to techno
Now, let's go, just give me the signal
I'll be there with a whole list full of new insults
I've been dope, suspenseful with a pencil
Ever since Prince turned himself into a symbol
But, sometimes, the shit just seems
Everybody only wants to discuss me
So this must mean I'm disgusting
But it's just me, I'm just obscene (Yeah)
Though I'm not the first king of controversy
I am the worst thing since Elvis Presley
To do Black music so selfishly
And use it to get myself wealthy (Hey!)
There's a concept that works
Twenty million other white rappers emerge
But no matter how many fish in the sea
It'd be so empty without me
Now, this looks like a job for me
So everybody, just follow me
'Cause we need a little controversy
'Cause it feels so empty without me
I said this looks like a job for me
So everybody, just follow me
'Cause we need a little controversy
'Cause it feels so empty without me
Hum, dei-dei, la-la
La-la, la-la-la
La-la, la-la-la
La-la, la-la
Hum, dei-dei, la-la
La-la, la-la-la
La-la, la-la-la
La-la, la-la
Kids!443Embed",https://images.genius.com/37f958ab28031af87d13b5d224749878.533x533x1.jpg
45,Eminem,The Real Slim Shady,The Real Slim Shady by Eminem,2000-04-18,2000,4,18,5551273,https://genius.com/Eminem-the-real-slim-shady-lyrics,0,2,3,"473 ContributorsThe Real Slim Shady Lyrics
May I have your attention, please?
May I have your attention, please?
Will the real Slim Shady please stand up?
I repeat
Will the real Slim Shady please stand up?
We're gonna have a problem here

Y'all act like you never seen a white person before
Jaws all on the floor like Pam, like Tommy just burst in the door
And started whoopin' her ass worse than before
They first were divorced, throwin' her over furniture (Agh!)
It's the return of the ""Oh, wait, no way, you're kidding
He didn't just say what I think he did, did he?""
And Dr. Dre said
Nothing, you idiots, Dr. Dre's dead, he's locked in my basement (Ha-ha!)
Feminist women love Eminem
""Chicka-chicka-chicka, Slim Shady, I'm sick of him
Look at him, walkin' around, grabbin' his you-know-what
Flippin' the you-know-who"", ""Yeah, but he's so cute though""
Yeah, I probably got a couple of screws up in my head loose
But no worse than what's goin' on in your parents' bedrooms
Sometimes I wanna get on TV and just let loose
But can't, but it's cool for Tom Green to hump a dead moose
""My bum is on your lips, my bum is on your lips""
And if I'm lucky, you might just give it a little kiss
And that's the message that we deliver to little kids
And expect them not to know what a woman's clitoris is
Of course, they're gonna know what intercourse is
By the time they hit fourth grade they've got the Discovery Channel, don't they?
We ain't nothin' but mammals
Well, some of us cannibals who cut other people open like cantaloupes
But if we can hump dead animals and antelopes
Then there's no reason that a man and another man can't elope
But if you feel like I feel, I got the antidote
Women, wave your pantyhose, sing the chorus, and it goes
You might also like
I'm Slim Shady, yes, I'm the real Shady
All you other Slim Shadys are just imitating
So won't the real Slim Shady please stand up
Please stand up, please stand up?
'Cause I'm Slim Shady, yes, I'm the real Shady
All you other Slim Shadys are just imitating
So won't the real Slim Shady please stand up
Please stand up, please stand up?

Will Smith don't gotta cuss in his raps to sell records (Nope)
Well, I do, so fuck him, and fuck you too
You think I give a damn about a Grammy?
Half of you critics can't even stomach me, let alone stand me
""But Slim, what if you win? Wouldn't it be weird?""
Why? So you guys could just lie to get me here?
So you can sit me here next to Britney Spears?
Yo, shit, Christina Aguilera better switch me chairs
So I can sit next to Carson Daly and Fred Durst
And hear 'em argue over who she gave head to first
Little bitch put me on blast on MTV
""Yeah, he's cute, but I think he's married to Kim, hee-hee""
I should download her audio on MP3
And show the whole world how you gave Eminem VD (Agh!)
I'm sick of you little girl and boy groups, all you do is annoy me
So I have been sent here to destroy you
And there's a million of us just like me
Who cuss like me, who just don't give a fuck like me
Who dress like me, walk, talk and act like me
And just might be the next best thing, but not quite me
'Cause I'm Slim Shady, yes, I'm the real Shady
All you other Slim Shadys are just imitating
So won't the real Slim Shady please stand up
Please stand up, please stand up?
'Cause I'm Slim Shady, yes, I'm the real Shady
All you other Slim Shadys are just imitating
So won't the real Slim Shady please stand up
Please stand up, please stand up?

I'm like a head trip to listen to 'cause I'm only givin' you
Things you joke about with your friends inside your livin' room
The only difference is I got the balls to say it in front of y'all
And I don't gotta be false or sugarcoat it at all
I just get on the mic and spit it
And whether you like to admit it (Err), I just shit it
Better than ninety percent of you rappers out can
Then you wonder: ""How can kids eat up these albums like Valiums?""
It's funny, 'cause at the rate I'm goin', when I'm thirty
I'll be the only person in the nursin' home flirting
Pinchin' nurse's asses when I'm jacking off with Jergens
And I'm jerking, but this whole bag of Viagra isn't working
And every single person is a Slim Shady lurkin'
He could be working at Burger King, spittin' on your onion rings (Ch, puh)
Or in the parkin' lot, circling, screaming, ""I don't give a fuck!""
With his windows down and his system up
So will the real Shady please stand up
And put one of those fingers on each hand up?
And be proud to be outta your mind and outta control
And one more time, loud as you can, how does it go?
I'm Slim Shady, yes, I'm the real Shady
All you other Slim Shadys are just imitating
So won't the real Slim Shady please stand up
Please stand up, please stand up?
'Cause I'm Slim Shady, yes, I'm the real Shady
All you other Slim Shadys are just imitating
So won't the real Slim Shady please stand up
Please stand up, please stand up?
'Cause I'm Slim Shady, yes, I'm the real Shady
All you other Slim Shadys are just imitating
So won't the real Slim Shady please stand up
Please stand up, please stand up?
'Cause I'm Slim Shady, yes, I'm the real Shady
All you other Slim Shadys are just imitating
So won't the real Slim Shady please stand up
Please stand up, please stand up?

Ha-ha
I guess there's a Slim Shady in all of us
Fuck it, let's all stand up433Embed",https://images.genius.com/37f958ab28031af87d13b5d224749878.533x533x1.jpg
46,Eminem,Stan,Stan by Eminem (Ft. Dido),2000-05-23,2000,5,23,5154260,https://genius.com/Eminem-stan-lyrics,1,2,4,"630 ContributorsTranslationsTürkçeDeutschMagyarPortuguêsFrançaisItalianoSvenskaStan Lyrics
My tea's gone cold, I'm wondering why I
Got out of bed at all
The morning rain clouds up my window
And I can't see at all
And even if I could, it'd all be grey
But your picture on my wall
It reminds me that it's not so bad, it's not so bad
My tea's gone cold, I'm wondering why I
Got out of bed at all
The morning rain clouds up my window
And I can't see at all
And even if I could, it'd all be grey
But your picture on my wall
It reminds me that it's not so bad, it's not so bad
Dear Slim, I wrote you, but you still ain't callin'
I left my cell, my pager and my home phone at the bottom
I sent two letters back in autumn, you must not've got 'em
There probably was a problem at the post office or somethin'
Sometimes I scribble addresses too sloppy when I jot 'em
But anyways, fuck it, what's been up, man? How's your daughter?
My girlfriend's pregnant too, I'm 'bout to be a father
If I have a daughter, guess what I'ma call her? I'ma name her Bonnie
I read about your Uncle Ronnie too, I'm sorry
I had a friend kill himself over some bitch who didn't want him
I know you probably hear this every day, but I'm your biggest fan
I even got the underground shit that you did with Skam
I got a room full of your posters and your pictures, man
I like the shit you did with Rawkus too, that shit was phat
Anyways, I hope you get this, man, hit me back
Just to chat, truly yours, your biggest fan, this is Stan
You might also like
My tea's gone cold, I'm wondering why I
Got out of bed at all
The morning rain clouds up my window
And I can't see at all
And even if I could, it'd all be grey
But your picture on my wall
It reminds me that it's not so bad, it's not so bad
Dear Slim, you still ain't called or wrote, I hope you have a chance
I ain't mad, I just think it's fucked up you don't answer fans
If you didn't want to talk to me outside your concert, you didn't have to
But you coulda signed an autograph for Matthew
That's my little brother, man, he's only six years old
We waited in the blisterin' cold for you, for four hours, and you just said, ""no""
That's pretty shitty, man, you're like his fuckin' idol
He wants to be just like you, man, he likes you more than I do
I ain't that mad, though I just don't like bein' lied to
Remember when we met in Denver? You said if I'd write you, you would write back
See, I'm just like you in a way: I never knew my father neither
He used to always cheat on my mom and beat her
I can relate to what you're sayin' in your songs
So when I have a shitty day, I drift away and put 'em on
'Cause I don't really got shit else, so that shit helps when I'm depressed
I even got a tattoo with your name across the chest
Sometimes I even cut myself to see how much it bleeds
It's like adrenaline, the pain is such a sudden rush for me
See, everything you say is real, and I respect you 'cause you tell it
My girlfriend's jealous 'cause I talk about you 24/7
But she don't know you like I know you, Slim, no one does
She don't know what it was like for people like us growin' up
You gotta call me, man, I'll be the biggest fan you'll ever lose
Sincerely yours, Stan—P.S. We should be together too
My tea's gone cold, I'm wondering why I
Got out of bed at all
The morning rain clouds up my window
And I can't see at all
And even if I could, it'd all be grey
But your picture on my wall
It reminds me that it's not so bad, it's not so bad
Dear Mr. I'm-Too-Good-to-Call-or-Write-My-Fans
This'll be the last package I ever send your ass
It's been six months, and still no word—I don't deserve it?
I know you got my last two letters, I wrote the addresses on 'em perfect
So this is my cassette I'm sendin' you, I hope you hear it
I'm in the car right now, I'm doin' ninety on the freeway
Hey, Slim, I drank a fifth of vodka, you dare me to drive?
You know the song by Phil Collins, ""In the Air of the Night""
About that guy who coulda saved that other guy from drownin'
But didn't, then Phil saw it all, then at a show he found him?
That's kinda how this is: you coulda rescued me from drownin'
Now it's too late, I'm on a thousand downers now—I'm drowsy
And all I wanted was a lousy letter or a call
I hope you know I ripped all of your pictures off the wall
I loved you, Slim, we coulda been together—think about it!
You ruined it now, I hope you can't sleep and you dream about it
And when you dream, I hope you can't sleep and you scream about it
I hope your conscience eats at you and you can't breathe without me
See, Slim—shut up, bitch! I'm tryin' to talk
Hey, Slim, that's my girlfriend screamin' in the trunk
But I didn't slit her throat, I just tied her up—see? I ain't like you
'Cause if she suffocates she'll suffer more and then she'll die too
Well, gotta go, I'm almost at the bridge now
Oh, shit, I forgot—how am I supposed to send this shit out?!
My tea's gone cold, I'm wondering why I
Got out of bed at all
The morning rain clouds up my window
And I can't see at all
And even if I could, it'd all be grey
But your picture on my wall
It reminds me that it's not so bad, it's not so bad

Dear Stan, I meant to write you sooner, but I just been busy
You said your girlfriend's pregnant now, how far along is she?
Look, I'm really flattered you would call your daughter that
And here's an autograph for your brother; I wrote it on a Starter cap
I'm sorry I didn't see you at the show, I must've missed you
Don't think I did that shit intentionally just to diss you
But what's this shit you said about you like to cut your wrists too?
I say that shit just clownin', dawg, come on, how fucked up is you?
You got some issues, Stan, I think you need some counselin'
To help your ass from bouncin' off the walls when you get down some
And what's this shit about us meant to be together?
That type of shit'll make me not want us to meet each other
I really think you and your girlfriend need each other
Or maybe you just need to treat her better
I hope you get to read this letter, I just hope it reaches you in time
Before you hurt yourself, I think that you'll be doin' just fine
If you relax a little, I'm glad I inspire you, but Stan
Why are you so mad? Try to understand that I do want you as a fan
I just don't want you to do some crazy shit
I seen this one shit on the news a couple weeks ago that made me sick
Some dude was drunk and drove his car over a bridge
And had his girlfriend in the trunk, and she was pregnant with his kid
And in the car they found a tape, but they didn't say who it was to
Come to think about it, his name was—it was you
Damn...664Embed",https://images.genius.com/37f958ab28031af87d13b5d224749878.533x533x1.jpg
47,Eminem,The Monster,The Monster by Eminem (Ft. Rihanna),2013-10-29,2013,10,29,4910446,https://genius.com/Eminem-the-monster-lyrics,1,2,7,"572 ContributorsTranslationsTürkçeไทย / Phasa ThaiPortuguêsItalianoFrançaisDeutschThe Monster Lyrics
I'm friends with the monster that's under my bed
Get along with the voices inside of my head
You're tryin' to save me, stop holdin' your breath
And you think I'm crazy, yeah, you think I'm crazy
I wanted the fame but not the cover of Newsweek
Oh well, guess beggars can't be choosey
Wanted to receive attention for my music
Wanted to be left alone in public, excuse me
For wantin' my cake, and eat it too, and wantin' it both ways
Fame made me a balloon 'cause my ego inflated
When I blew, see, but it was confusing
'Cause all I wanted to do's be the Bruce Lee of loose leaf
Abused ink, used it as a tool when I blew steam
Whoo! Hit the lottery, ooh-wee!
But with what I gave up to get it was bittersweet
It was like winnin' a used mink
Ironic 'cause I think I'm gettin' so huge I need a shrink
I'm beginnin' to lose sleep: one sheep, two sheep
Goin' coo-coo and kooky as Kool Keith
But I'm actually weirder than you think, 'cause I'm—
I'm friends with the monster that's under my bed
Get along with the voices inside of my head
You're tryin' to save me, stop holdin' your breath
And you think I'm crazy, yeah, you think I'm crazy
Well, that's nothin'
You might also like
(New-ooh, ooh-ooh)
(New-ooh, ooh-ooh)
(New-ooh, ooh-ooh)
Well, that's nothin'
(New-ooh, ooh-ooh)
(New-ooh, ooh-ooh)
(New-ooh, ooh-ooh)
(New-ooh, ooh-ooh)

Now, I ain't much of a poet
But I know somebody once told me to seize the moment
And don't squander it 'cause you never know when it all
Could be over tomorrow, so I keep conjurin'
Sometimes I wonder where these thoughts spawn from
Yeah, ponderin'll do you wonders
No wonder you're losin' your mind, the way it wanders
(New-ooh, ooh-ooh) Yodel-odel-ay-hee-hoo!
I think it went wanderin' off down yonder
And stumbled onto Jeff VanVonderen
'Cause I need an interventionist
To intervene between me and this monster
And save me from myself and all this conflict
'Cause the very thing that I love's killin' me and I can't conquer it
My OCD's conkin' me in the head, keep knockin'
Nobody's home, I'm sleepwalkin'
I'm just relayin' what the voice in my head's sayin'
Don't shoot the messenger, I'm just friends with the—
I'm friends with the monster that's under my bed
Get along with the voices inside of my head
You're tryin' to save me, stop holdin' your breath
And you think I'm crazy, yeah, you think I'm crazy
Well, that's nothin'
(New-ooh, ooh-ooh)
(New-ooh, ooh-ooh)
(New-ooh, ooh-ooh)
Well, that's nothin'
(New-ooh, ooh-ooh)
(New-ooh, ooh-ooh)
(New-ooh, ooh-ooh)
(New-ooh, ooh-ooh)

Call me crazy, but I have this vision, one day that
I'll walk amongst you a regular civilian
But until then, drums get killed and
I'm comin' straight at MCs, blood gets spilled and
I'll take you back to the days that I'd get on a Dre track
Give every kid who got played that pumped-up feelin'
And shit to say back to the kids who played him
I ain't here to save the fuckin' children
But if one kid out of a hundred million
Who are goin' through a struggle, feels it and relates, that's great
It's payback, Russell Wilson fallin' way back
In the draft, turn nothin' into somethin', still can make that
Straw into gold, chump, I will spin—Rumpelstiltskin in a haystack
Maybe I need a straightjacket
Face facts: I am nuts for real, but I'm okay with that
It's nothin', I'm still friends with the
I'm friends with the monster that's under my bed
Get along with the voices inside of my head
You're tryin' to save me, stop holdin' your breath
And you think I'm crazy, yeah, you think I'm crazy
I'm friends with the monster that's under my bed
(Get along with) Get along with the voices inside of my head
(You're tryin' to) You're tryin' to save me, stop holdin' your breath
(And you think) And you think I'm crazy, yeah, you think I'm crazy
Well, that's nothin'
(New-ooh, ooh-ooh)
(New-ooh, ooh-ooh)
(New-ooh, ooh-ooh)
Well, that's nothin'
(New-ooh, ooh-ooh)
(New-ooh, ooh-ooh)
(New-ooh, ooh-ooh)
(New-ooh, ooh-ooh)909Embed",https://images.genius.com/37f958ab28031af87d13b5d224749878.533x533x1.jpg
