,Artist,Song Title,Full Title,Release Date,Year,Month,Day,Pageviews,url,featured_count,producer_count,writer_count,Song Lyrics,Artist Image
147,MF DOOM,Deep Fried Frenz,Deep Fried Frenz by MF DOOM,2004-11-16,2004,11,16,305339,https://genius.com/Mf-doom-deep-fried-frenz-lyrics,0,1,1,"145 ContributorsDeep Fried Frenz Lyrics
Before we go any further
Friends

As you call 'em, they call you when they need something
Trees for the bluntin', to G's for the frontin'
I found a way to get peace of mind for years and left the hell alone
Turn a deaf ear to the cellular phone
Send me a letter or better, we could see each other in real life
Just so you could feel me like a steel knife
At least so you could see the white of they eyes
Bright with surprise, once they finish spitting lies
Associates, is your boys, your girls, bitches, niggas, homies
Close, or really don't know me
Mom, dad, comrade, peeps, brothers, sisters, duns, dunnies
Some come around when they need some money
Others make us laugh like the Sunday funnies
Fam be around whether you paid or bummy
You could either ignore this advice or take it from me:
Be too nice and people take you for a dummy
So nowadays, he ain't so friendly
Actually they wouldn’t even made a worthy enemy
Read the signs: ""No feeding the baboons""
Seein' as how they got ya back bleeding from the stab wounds
Y'all know the dance, they smile in ya face, y'all know the glance
Try to put 'em on, they blow the chance
Never let your so-called mans know your plans
(How many of us have them?) A show of hands
(Friends) is a term some people use loosely
I'm real choosy on what I choose to let crew see
You telling me I try to act broke
Jealousy the number one killer among black folk
Fellas be under some type of spell like crack smoke
Ghetto Cinderellas lead 'em right to your stack, loc
Just another way a chick'll lead to your end
I checked the dictionary for the meaning of friend
It said: ""person one likes to socialize with
Sympathizer, helper"", and that's about the size of it
Most of the time these attributes is one-sided
To bolster the crime, they're apt to shoot you through your eyelid
And they can't hide it, going wild like a white bitch
Sometimes ya need to cut niggas off like a light switch
(Flick!) And when things get quiet
Catch 'em like a thief in the night, what a riot
I first met Mr. Fantastik at a arms deal
Don't let it get drastic, think of how your moms'll feel
When it get for real, steel get to sparkin'
Everything darken, it ain't no talkin'
For somethin' so cheap, it sure buys a lot of trouble
Ya better off focusing than tryin' to plot to bubble
Or else it'd be a sad note to end on, the guns we got is
(One's we can depend on, friends)
Some come in the form of co-dependents
A lot of times only end up being co-defendants
Ten bucks say they tell for a lower sentence
And leave you up under the jail, begging for repentance
It don't make no sense, what happened to the loyalty?
Honor amongst crooks, trust among royalty
I'd rather go out in a blaze than give 'em the glory
(How many of us have—) a similar story?
(Friends) before lovers, we used to have some type of over-standing
Just so when I let her get the man thing
She know it's no strings, we could do the damn thing
But ho, it's no rings, just how the tramp swings
Will she see him again? That depends on
""How good was the skins?"" and ""Could she memorize the lessons?""
It ain't no need to pretend
Even though she let him stab it, she know they're just friends
You might also like
Friends
How many of us have them?
Friends
Ones we can depend on?
Friends
How many of us have them?
Friends
Before we go any further

Fellas! Don't be silly! I know who my friends are!
And the next nice neighborhood I move into, you guys'll get crack'
(Negro humor always escaped me.)
[Outro Skit: Character 1; Mr. Fantastic; (Invisible Woman);
Dr. DOOM; Character 2]
The most powerful, the most mysterious monarch in all the world
Guided by a fighting force that never sleeps
That never relaxes its vigilance
For none is as feared, none has as many foes
As DOOM, the awesome armorclad lord of
I know who Doom is (Then tell us)
He happens to be the most dangerous man in the world
I’d hope we’d never hear from him
I’d hope we’d never have to battle him
But now the worst has happened and I must tell you what we’re up against
I first met DOOM years ago
When he wanted to be alone, alone to pursue his forbidden experiments
One day while conducting a secret experiment
 Later, when he recovered from his injuries
Instead of having learned his lesson, DOOM was bitter, angry, vengeful
 What have I done to myself?
My face, it is hideous
He traveled the world, seeking a cure for his disfigured face
(I’m sorry sir, there is nothing we can do for you)
He traveled through remote villages, where strangers are seldom seen
He continued his search, never showing his face
Unless threatened by bandits who prey on travelers
Who foolishly wander alone through their domain32Embed",https://images.genius.com/263743633b6e58854e753b25dca6beab.430x430x1.jpg
148,MF DOOM,Potholderz,Potholderz by MF DOOM (Ft. Count Bass D),2003-09-02,2003,9,2,205602,https://genius.com/Mf-doom-potholderz-lyrics,1,1,2,"145 ContributorsPotholderz Lyrics
(Hot shit) (Aww shit)

I strive to be humble, lest I stumble
Never sold a jumbo or copped chicken with its mumbo
Sauce, Tyson is a fowl holocaust
Hitler gassed your whole head up with poultry, I'm fed up
Ignore cordon bleu, stand up, get up
Lunge for your knife, don't forget your potholders
(Hot shit)

What, these old things? About to throw 'em away
With the gold rings that make 'em don't fit like OJ
Usually I take them off with Oil of Olay
MCs is crabs in a barrel, pass the Old Bay
Hot as hell and it's a cold day, innit?
Working on a way that we can roll away tinted
Some say the price of holding heat is often too high
You either be in a coffin or you be the new guy
The one that's too fly to eat shoo pie
Never too busy when it comes down to you and I
(Swear to God) A lot of niggas wish to die
They need to hold they horses, there's bigger fish to fry
You're on the list, if not, pick a number spot
Ten and a half Timbs is made to kick your bumba claat
I coulda had a V-8
F-150 quad cab but I'll be straight
Money comes and goes like that two bit hussy
That night that tried to rush me, Dwight, pass the dutchie
So I can calm down so they don't get it twisted
Take it from the fire side, it won't get blistered
Got it, what happened? Oh, it's not lit
These metal fingers be holding (Hot shit)
You might also like
When I was four, I penned ""God Was Born In New York""
Back in '77, still got nan in the crescent
The effervescence of God's presence is thick
Unlike vapor, Esther Rolle, extra raw, word to the baker
Peace to the hardworkin' gingerbread makers
Looked her up and down, said: ""Hmm, too much makeup""
Poor music taste, ten years from being grown up
Rappers don't blow up, heads do (Aww, shit)
My name is Dwight Spitz, I'm a Sonic addict
I use to think it was merely a nagging habit
Born under a bad sign, I'm serious about this curse of mine
I strive to flip it into fine wine
""Barely born a virgin"" is what the stars said
Black not white, red all over, though, like Elmo
Twenty-eight years have passed, I feel I'm peaking
I make music every weekend
It's a chore, a fact of life, a labor of love
I get mad love, but I detest the labor
And its wages—you know, death?
I'm servin' life from this gift of God
Don't forget your potholders, my niggas

(More hot shit)
(More hot shit)
(More hot shit)
A short time later31Embed",https://images.genius.com/263743633b6e58854e753b25dca6beab.430x430x1.jpg
149,MF DOOM,Gazzillion Ear,Gazzillion Ear by MF DOOM (Ft. J Dilla),2009-03-24,2009,3,24,194769,https://genius.com/Mf-doom-gazzillion-ear-lyrics,1,1,2,"149 ContributorsGazzillion Ear Lyrics
Villain man never ran with krills in his hand and
Won't stop rockin' til he clocked in a gazillion grand
Tillin' the wasteland sands
Raps on backs of treasure maps, stacks to the ceilin' fan
He rest when he's ashes
Ask 'em after ten miles in his galoshes, smashes stashes
Chip on his shoulder with a slip on holster
A clip, a folder and his grip on a boulder bolster
They supposed to know, it show when his aura glow
Get from out the row, when he get dough, it's horrible
Time is money, spend, waste, save, invest the fess
For ten K's, he'll cave a chicken chest S
Yes, y'all, the dub will get you trickles
The best ballers pitch in and rub together nickels
But, tut-tut, he 'bout to change the price again
It go up each time he blow up like hydrogen
Villain here, have 'em shrillin' in fear
And won't stop top illin' 'til he a gazillionaire
Grillin' stare, yeah, your boy had drama
Got 'em on a mental plane, avoided bad karma
Once sold an inbred skinhead a nigga joke
Plus a brand-new chrome smoker with the triggers broke
I thought I told 'em, ""Firing pins was separate""
He find out later when he tries to go and rep it
Took a Jehovah money for a Arabic Torah
Charged in advance to translate it and ignored her, sorta
One monkey don't stop no slaughter
A junkie wanna cop a quarter-ton, run for the border
Know the drill, it ain't worth the overkill
Flow skill, still, there's no thrill
Fill a billion 10K bills in his pillow
Villain, when it gets realer, split the skrilla with—
You might also like

Dilla (Dilla) mix, mix, mix
Do a deal for kicks and get rich quick
Sketch lyric, bet your bottom nick' on some vic'
Ick from the drumstick come with the dumb schtick
Sick slick, hidden in a book
The only way they find it if it's spittin' in a hook
Listen, don't look now, keep walkin'
Traded three beans for this cow, cheap talkin'
Hawk men stalkin' hear that we hawkin' often
Coughin' to a coffin, might as well scoff the pork then
He's like Worf, some say stronger though
Off the top, Jay Strongbow, play along bro
Wear a mask like yo, off The Gong Show
Flow slow as Mongo, Don Juan thong pro
For ya info when he's not practicin' Jim Crow
Or actressing some nympho bimbo
He's playin' Ray J, the old tape
DOOM—well what can I say like JJ in a gold cape
Fill it to the rim like brim
Villain and ya won't find him in no gym
Probably a foggy bog with the frogs
With a dot on the guard as he squat on a log
Half cocked and half baked
Used to keep a full stock of work, half rocked and half shake
My mistake, sign a track agreement
For more G's than lines and cracks in the cement
In any event, it's fake like wrestlin'
Get 'em like Jake The Snake on mescalines
Ahem—elixir for the dry throat
Tried to hit the high note, Villain since a itsy bitsy zygote
By remote, send in the meat wagon
Braggin' MC's packed in with they feets draggin'
These stats are staggerin'
Had his Ph.D in indiscreet street hagglin'

Villain, his agenda is clear
Endin' this year with dividends to spare, here
It's not meant for the seein'
Went through the ceilin' after enterin' his center bein'
A new meanin' to sales through the roof
Guaranteed raw and saw his truth was truth, proof
It's the return of the tramp
Who do a duet jam when Ernest goes to camp
For the right earn, na'mean? Like Vern
We need some more oil for the machines to burn, learn
Jiminy Crickets
He gets lucky like winnin' free tickets off sickly lyrics
One man's waste is another man's soap
Son's fanbase know the brother-man's dope
A real weirdo with a bugged, rare flow
And the way his hair grow was ugly as a scarecrow
He wears a mask so the charge won't grab
On a rooftop with a large stone slab
Heads up, talk white and thought niggerish
Refuse to walk tight and got his off the vigorish
Black licorice and equally as yucky
How he handled the money was strictly Dan Stuckie
Monkey hustle, man on fire
Later for the date than the Hadron Collider
And cost more, it be seemin' like a style
DOOM leave the competition steamin' like a pile
Smile (ding!) Sparklin' jewels
In effect like alternate side of the street parkin' rules
Fools, the roach was never dead
Live for a week, then dehydrate with a severed head
Instead, it was depicted as flicked in
Split, the wigs lit (Can you dig it?)
We have got to try and find DOOM!
Good luck!26Embed",https://images.genius.com/263743633b6e58854e753b25dca6beab.430x430x1.jpg
150,MF DOOM,Vomitspit,Vomitspit by MF DOOM,2004-11-16,2004,11,16,182290,https://genius.com/Mf-doom-vomitspit-lyrics,0,1,1,"128 ContributorsVomitspit Lyrics
It's the beat (DOOM), he hear it in his sleep sometimes
Blare it in your jeep so your peoples can stare at them rhymes
Real rhymes not your everyday hologram
Even when ribs was touchin', never swallowed the ham
He'd rather eat a sand sandwich salad
It might need salt like your man's bland ballad
A lot of stuff happens that the news won't tell you's
Blues on L juice, snooze, all hell loose
Rake it, take it like the good, the bad, the ugly
Break it, rollin' through ya hood in the caddy buggy
Butter softy, leather flossy, fatty juggy
Always threw me off when she told me, ""Daddy, funk me""
I'm like, ""Anywho's""
Seeds walkin' all out in the street without any shoes
I guess it's better than some funky socks
You need to get her some skips before she catch the monkey pox (Hahahahaha)
Instead she wanna hear the beatbox
Take pills and make fake krills as sheetrock
Sing it, bring it back to your laboratory
While he's in his oratory, glory, it's like a horror story
The mask is like Jason
They told the place not to let the basket type case in
He could be some kind of wacko
Waitin' for the chance to heat the pipes like a crack ho
He busted in, blessed be the Lord
Who believe any mess they read up on a message board
If so, I got bridges for the low low
Same bitch a-go dry snitchin' to the popo
Here, orange peel stogs for the whole tier
Feel like I've been gone over a year, came home to old gear
It was the shit when I first scooped it
At least I get to sit out in New York and curse stupid
Plead the fifth, sip wine stiffly
Patiently come up and be spiffy in a jiffy
Gift for the grind, criminal mind shifty
Swift with the nine through a fifty nine fifty
Well edumacated, he heard it when he meditated 9n deep theta
Let her hate, the creep played her
Dedicated cheap skata who keeps data
Say he stay self medicated to sleep later
Side effects is similar to sugar pill
Whoever go next on the mic he put a booger, ill
And made his exit on some calm shit
Begged him on the regular for kegs of more vomitspit
(""DOOM!"")You might also like36Embed",https://images.genius.com/263743633b6e58854e753b25dca6beab.430x430x1.jpg
151,MF DOOM,? (Question Mark),? (Question Mark) by MF DOOM (Ft. Kurious),1999-10-19,1999,10,19,163570,https://genius.com/Mf-doom-question-mark-lyrics,1,1,2,"120 ContributorsTranslationsРусский? (Question Mark) Lyrics
My servants began to forge what was to become the most dreaded costume on the face of the earth. The last thing to fit was the mask. Would it conform to my twisted features in comfort?

He cleans his metal mask with gasoline, they after him
Last seen pulling chicks like a fiend pull a fast one
Can't put shit past him
Got niggas on his own team mad enough to blast him
Retarded in real life, on the mic Rain Man
Stand close to his main man like a chain gang
Who give a fuck about who or they fancy crew
That's no mystery, like Hardy Boys do with Nancy Drew
Saw her with her drawers down, caught her
The extorter bring slaughter like ""Well I oughta""
I suggest you hand over the formula, 'dullah
A villain in your land, in his land a ruler
Hard hitting like puffing a woolah with Lieutenant Uhura
Every day feel like it's an off day with Ferris Bueller
Brother pull heat to prove they not sweet
No matter how you spell it, we still got beats

Don't question how we live, question what we give
Take it to the next leave 'em where they can't see me
Still they judge, but they be butt ass
Twist that wig like a muppet, keep it simple, can't truss it
Light's the fuel, mic is the tool
Drink Jack, kick back, drop jewel, finish what I start
Mastered the art, living hell can't explain it
Inhale confuse it more, cop the .44
Contemplate, meditate, dictate
I direct my direct fate, coming of late
Kurious, can I say, ""Shit?""
Do it for Kadi Rock, do it for K.Nit
(RIP)
K-N-I-T, Sub R-O-C
(Eternally for M-I-C)
Only we save we
You might also like

By candlelight my hand will write these rhymes 'til I'm burnt out
Mostly from experience, shit that I learned about
Topics and views, generally concerned about
With different ways to come up and earn clout
I take a look at my life and pace the trails
From Tablik and savage females with fake nails to face veils
You out your frame for still bagging 'em, too
You know I know, these hoes be asking me if I'm you
Like my twin brother, we did everything together
From hundred raka'at salats to copping butter leathers
Remember when you went and got the dark blue Ballys?
I had all the different color Cazals and Gazelles
The ""SUBROC"" three-finger ring with the ruby in the ""O"", ahk
Truly the illest dynamic duo on the whole block
I keep a flick of you with the machete sword in your hand
Everything is going according to plan man

And now I seek revenge on the one who forced me to hide behind this mask. Don't move you fools. Within my gauntlet is concealed a most effective weapon!

Why are you smiling?
You see

Now!

That's the end of Doom

I only wish we could be certain of that commissioner

Oh ya? I bet'chu we won't see him again until Doomsday. 
Get it? Doom-Doomsday!

Ya, we get it. Oh Brother!
23Embed",https://images.genius.com/263743633b6e58854e753b25dca6beab.430x430x1.jpg
152,MF DOOM,All Outta Ale,All Outta Ale by MF DOOM,2002-10-01,2002,10,1,163161,https://genius.com/Mf-doom-all-outta-ale-lyrics,0,1,1,"72 ContributorsAll Outta Ale Lyrics
One more beer
And I'll take you all
All of you

Banned from all bars
The man with seven scars

Smack it up, flip it, pulled out, 'bout to fell
Sunday in the ATL and I'm all outta ale
Like a bat out of hell, tripped on a cat tail
Mutt drinkin out a pail, who let the rat out the cell?
Got all the ingredients and recipe, might as well
Since last week, the bootlegger been in jail
If all else fail, inhale the L
Makin' sure they can't see your sale via snail mail
Mind like a sewer, servin' rhyme on a skewer
DOOM'll step to a fine dime like he knew her
""My black sister!"" She said, ""Step back!"" before he kissed her
She did the dipper and the smack just missed her
There go a list of politics like Henry Kissinger
99% of rap's just a friendly listener
I'm like, ""These dudes must have some screws loose to hate y'all""
Or a couple of ounces short of deuce-deuce or 8 Ball
Y'all know it's time for the end when the day come
Buy a album, get rudely insulted over fake drums
Same CDs you get for free, you break 'em
Wa-alaikum, make 'em eat they food like Steak-umm
Why she wanna ask me if I could pass the paprika?
One hand on the mic, the other on the beaker
Every week or so, peeked out the lab though, eureka!
A technique to keep somethin' uniquer in ya speaker
For yo' information, I didn't do the beat, y'all
It ain't my fault if she didn't move her feet at all
Skeeter, robbed Peter to pay Paul
So he could trick it on Mary so she can play ball
You might also like
She better have my skrilla
Cut it out with all that funny hand jive, will ya?
All this trouble for a tall glass of Olde E
Drink it all fast and make you haul ass slowly
Remind me to remember what you told me
Holy moly, did you get a load of her roly-poly?
Yo, G, remind me to remember what you told me
Whoever don't feel him, feel balls like a goalie

One for the money, two for the better green
3,4-Methylenedioxymethamphetamine
Told the knock-kneed ghetto queen, ""Get the head fiend""
Tell him it's from Medellin and use oxyacetylene
Who needs airplay? It's all just hearsay
Leave a wig like it was having a bad hair day
Miracle glide master, asked him what's his secret
He said, ""Shasta, it turns to formaldehyde faster""
When I'm home with my lady, I try to duke her daily
One night, she tried to flail me with her ukulele
Pack your heat, the Villain on the cover of Black Beat
With a bunch of crackers and some snack meat

They better have my skrilla
Cut it out with all that funny hand jive, will ya?
All this trouble for a tall glass of Olde E
Drink it all fast and make you haul ass slowly
Remind me to remember what you told me
Holy moly, did you get a load of her roly-poly?
Yo, G, remind me to remember what you told me9Embed",https://images.genius.com/263743633b6e58854e753b25dca6beab.430x430x1.jpg
153,MF DOOM,Kon Karne,Kon Karne by MF DOOM,2004-01-22,2004,1,22,159031,https://genius.com/Mf-doom-kon-karne-lyrics,0,1,1,"129 ContributorsKon Karne Lyrics
Darker than the East River, larger than the Empire State
Where the beast who guard the barbed wire gate
Is on the job—not my fate, tired of the wait
'Til the Villain bring deliverance from the dire straits
Fire at a higher rate, why debate the liars?
Fliers scatter, buy a plate—isolate the wires
Try the straight pliers, if not—the vice grips
A real price-saver way to acquire nice whips
What a steal for real on wheels of steel
Stunner, a funner summer number-one meal deal-bummer
A bizarre phenomenon—is your armor on?
Take your cash, Karma, or break your fast—Ramadan
Transaction drama—aw, come on, Barney
Clack, clack—pardon me, whack rap con carne
He came to feed the childrens like Sally Struthers
After that, he's going back to Cali, where's the—(""—love is—"")
Wilder than the Nile, hold power like the great pyramids
Of Giza, and stay leanin' like the tower of Pisa
Give him something he can feel that's soft to squeeza
Raw with the pen, and on the mic—off the hezza
Get shot off that wide-eyed talk
And if he had a pot, he'd still piss on the sidewalk
Can't take the street out the street-person
Lookin' for the perfect beat, coercion into heat-burstin'
They couldn't spot him on the spot date
Got the only tape that come with a free hot-plate
Whoever do get to see me sing
With the 3 D-ring sittin' stationary like B.B. King
Can see how it really sting, it ain't no front row
Standing room only at the motocross stunt show
The ruckus ain't up to Snuffleupagus
Me and Sub' is like the brown Smothers Brothers (""My love is—"")
Vaster than the seven seas, bigger than Mount Kilimanjaro
If they don't know, fill 'em in tomorrow
On the horror show, a mental note: return Bob’s record
Swear to God, before he gets a job, he robs an Eckerd
Blessed with a hot flow, tested it, got dough
Invested in stress, the best to finesse an opto
As I reminisce, never forgot when I was very broke
Shot the Henny straight, couldn't afford to cop the Cherry Coke
Or should I say, broke with wealth?
To know enough to give them just enough rope to yoke they self
Plan B before I take the ring and pawn it
The long arm of the law couldn't even put they fingers on it
Dog-gone it, do the statistics
How he bust lyrics, it's too futuristic for ballistics
And far too eccentric for forensics
I dedicate this mix to Subroc, the hip-hop Hendrix
You might also like
""In my pocket, a note. 
It's—from my father.""
""—from the guard's whip. Is this a trick?
Why would I resort to trickery? You're already a prisoner. What do I gain by deceiving you?
You can't blame me for being suspicious.""
""No.""
Hehe
23Embed",https://images.genius.com/263743633b6e58854e753b25dca6beab.430x430x1.jpg
